restaurant_id,id,url,text,rating,time_created,user
oBry7omEm5kavp_l86AjCA,yfoYiJ3dOaDj-UcOxLvvIQ,https://www.yelp.com/biz/khajuraho-paris?adjust_creative=Gfp9qSmSlgBP7eaVzQe-WQ&hrid=yfoYiJ3dOaDj-UcOxLvvIQ&utm_campaign=yelp_api_v3&utm_medium=api_v3_business_reviews&utm_source=Gfp9qSmSlgBP7eaVzQe-WQ,"Wow.. this place has amazing food!  If you're craving great Indian food with nice ambience & attentive, kind waitstaff.. this is the place!",5,2022-01-29 08:47:46,"{'id': '5E5GdSqmj6u8_HJDIx5CfQ', 'profile_url': 'https://www.yelp.com/user_details?userid=5E5GdSqmj6u8_HJDIx5CfQ', 'image_url': 'https://s3-media1.fl.yelpcdn.com/photo/bcGsncs-A23QBt0yzah0PA/o.jpg', 'name': 'Kim R.'}"
kGCB1YFIkkeOMN4Yh8iUXQ,PD-9Zsph3mZv3ZK5VigN9g,https://www.yelp.com/biz/le-bon-p%C3%AAcheur-paris-2?adjust_creative=Gfp9qSmSlgBP7eaVzQe-WQ&hrid=PD-9Zsph3mZv3ZK5VigN9g&utm_campaign=yelp_api_v3&utm_medium=api_v3_business_reviews&utm_source=Gfp9qSmSlgBP7eaVzQe-WQ,"I was starved and entered with the hopes to find a good croque madam, and voila! 
Yes, service is kind of slow as it is in every Parisian place, mostly if...",4,2020-01-06 17:46:31,"{'id': '7PbeqZJhp8iER3xnSnaNpQ', 'profile_url': 'https://www.yelp.com/user_details?userid=7PbeqZJhp8iER3xnSnaNpQ', 'image_url': 'https://s3-media2.fl.yelpcdn.com/photo/vm4pnLv1JWEMqaAoJfJZZA/o.jpg', 'name': 'Francesca C.'}"
kGCB1YFIkkeOMN4Yh8iUXQ,P0b6_pJwTaLb5qc4LFwwgw,https://www.yelp.com/biz/le-bon-p%C3%AAcheur-paris-2?adjust_creative=Gfp9qSmSlgBP7eaVzQe-WQ&hrid=P0b6_pJwTaLb5qc4LFwwgw&utm_campaign=yelp_api_v3&utm_medium=api_v3_business_reviews&utm_source=Gfp9qSmSlgBP7eaVzQe-WQ,What a great location and vibe. Attentive staff and good food. Recommend this for group of friends our for a fun evening.,5,2022-06-21 13:53:11,"{'id': 'wy0pIPwoCSdfRCkI9YBRFw', 'profile_url': 'https://www.yelp.com/user_details?userid=wy0pIPwoCSdfRCkI9YBRFw', 'image_url': None, 'name': 'Anne H.'}"
kGCB1YFIkkeOMN4Yh8iUXQ,_gGuAyCRaNWMn6RmJXBLLA,https://www.yelp.com/biz/le-bon-p%C3%AAcheur-paris-2?adjust_creative=Gfp9qSmSlgBP7eaVzQe-WQ&hrid=_gGuAyCRaNWMn6RmJXBLLA&utm_campaign=yelp_api_v3&utm_medium=api_v3_business_reviews&utm_source=Gfp9qSmSlgBP7eaVzQe-WQ,"If you are like me and want to eat and drink your way through Paris this place is great and authentic. 

I have been coming here for years. It is extremely...",5,2019-06-23 05:58:20,"{'id': 's9Kx9R6nwbnrX_d_CFIhpQ', 'profile_url': 'https://www.yelp.com/user_details?userid=s9Kx9R6nwbnrX_d_CFIhpQ', 'image_url': 'https://s3-media2.fl.yelpcdn.com/photo/n9NMWWwq84PSCUgd9IaF3g/o.jpg', 'name': 'Genny C.'}"
MfmIKDTvTNfpdID38qWVag,Ql6OPtC-99bn6ehFuvBVCA,https://www.yelp.com/biz/le-porte-pot-paris?adjust_creative=Gfp9qSmSlgBP7eaVzQe-WQ&hrid=Ql6OPtC-99bn6ehFuvBVCA&utm_campaign=yelp_api_v3&utm_medium=api_v3_business_reviews&utm_source=Gfp9qSmSlgBP7eaVzQe-WQ,"I first discovered Le Porte Pot when visiting Paris in the spring of 2017, tempted in by the many positive reviews and proximity to where we were staying. I...",5,2019-08-23 16:51:20,"{'id': 'ls5cIlbemOJ2HRqH9zI0EA', 'profile_url': 'https://www.yelp.com/user_details?userid=ls5cIlbemOJ2HRqH9zI0EA', 'image_url': 'https://s3-media2.fl.yelpcdn.com/photo/9smp3E7iF8DfX7G4MvUtaQ/o.jpg', 'name': 'Erik D.'}"
MfmIKDTvTNfpdID38qWVag,HICZAx1NNAYZ-VByJoItaw,https://www.yelp.com/biz/le-porte-pot-paris?adjust_creative=Gfp9qSmSlgBP7eaVzQe-WQ&hrid=HICZAx1NNAYZ-VByJoItaw&utm_campaign=yelp_api_v3&utm_medium=api_v3_business_reviews&utm_source=Gfp9qSmSlgBP7eaVzQe-WQ,"Le Porte Pot is probably what you imagine when you think of a bistro in the heart of Paris.

Nestled in an alley just a few blocks from the Notre Dame...",4,2018-09-20 11:43:45,"{'id': 'dqo-o6O847KTF3NDADxxDg', 'profile_url': 'https://www.yelp.com/user_details?userid=dqo-o6O847KTF3NDADxxDg', 'image_url': 'https://s3-media1.fl.yelpcdn.com/photo/-tV5MK6IaQa3AdqunGcMeA/o.jpg', 'name': 'Craig G.'}"
MfmIKDTvTNfpdID38qWVag,Gm5dLJpCYiPxTxy3X1izMg,https://www.yelp.com/biz/le-porte-pot-paris?adjust_creative=Gfp9qSmSlgBP7eaVzQe-WQ&hrid=Gm5dLJpCYiPxTxy3X1izMg&utm_campaign=yelp_api_v3&utm_medium=api_v3_business_reviews&utm_source=Gfp9qSmSlgBP7eaVzQe-WQ,Our first night in Paris we found this on Yelp and well it was delicious. It had the best foie gras of the entire trip. It was a cold terrine with salt...,4,2019-11-09 10:28:26,"{'id': 'uQbMVTaQ_UIqhrQgj4Y28A', 'profile_url': 'https://www.yelp.com/user_details?userid=uQbMVTaQ_UIqhrQgj4Y28A', 'image_url': 'https://s3-media2.fl.yelpcdn.com/photo/riS3pv9HpA1bQB2gTxolFw/o.jpg', 'name': 'Adria D.'}"
lBueZXrEbdSdvujDlQUB-w,OqaXvVbeFUHN3FG5XjuKPA,https://www.yelp.com/biz/le-louch%C3%A9bem-paris-4?adjust_creative=Gfp9qSmSlgBP7eaVzQe-WQ&hrid=OqaXvVbeFUHN3FG5XjuKPA&utm_campaign=yelp_api_v3&utm_medium=api_v3_business_reviews&utm_source=Gfp9qSmSlgBP7eaVzQe-WQ,"This place is amazing!!!! Great selection with so many varieties of meat! Very welcoming and friendly staff. Bread is delicious! 

I ordered my filet medium...",5,2019-03-14 07:08:00,"{'id': 'JEmgSQ6w9BoAaSGNGaIMzA', 'profile_url': 'https://www.yelp.com/user_details?userid=JEmgSQ6w9BoAaSGNGaIMzA', 'image_url': 'https://s3-media2.fl.yelpcdn.com/photo/SwiIK9AoHHw68pRg_Y1P1A/o.jpg', 'name': 'Tiffany P.'}"
lBueZXrEbdSdvujDlQUB-w,GVNq9AHCwv1wRL7HxUV5-w,https://www.yelp.com/biz/le-louch%C3%A9bem-paris-4?adjust_creative=Gfp9qSmSlgBP7eaVzQe-WQ&hrid=GVNq9AHCwv1wRL7HxUV5-w&utm_campaign=yelp_api_v3&utm_medium=api_v3_business_reviews&utm_source=Gfp9qSmSlgBP7eaVzQe-WQ,We tried this place for dessert tonight and they totally ripped us off. My partner and I ordered a profiteroles dessert which was described on the menu as...,1,2023-05-10 13:08:32,"{'id': 'dsIoKMs82dt2Pkln_UiBSQ', 'profile_url': 'https://www.yelp.com/user_details?userid=dsIoKMs82dt2Pkln_UiBSQ', 'image_url': 'https://s3-media1.fl.yelpcdn.com/photo/4ECvJ35paR69IgkDdff5fQ/o.jpg', 'name': 'David M.'}"
lBueZXrEbdSdvujDlQUB-w,Ekqrz2KcZDaucuF-BD7NeA,https://www.yelp.com/biz/le-louch%C3%A9bem-paris-4?adjust_creative=Gfp9qSmSlgBP7eaVzQe-WQ&hrid=Ekqrz2KcZDaucuF-BD7NeA&utm_campaign=yelp_api_v3&utm_medium=api_v3_business_reviews&utm_source=Gfp9qSmSlgBP7eaVzQe-WQ,Came here to try horse steak. Was delicious. Hard to find horse in France. This place delivered!,5,2022-09-25 11:06:05,"{'id': 'mdOST9xnrp_siOH5Vn4Kcw', 'profile_url': 'https://www.yelp.com/user_details?userid=mdOST9xnrp_siOH5Vn4Kcw', 'image_url': 'https://s3-media3.fl.yelpcdn.com/photo/Tfap3ibTLiYdtzL8vRbplg/o.jpg', 'name': 'John B.'}"
657yy3D4SwyQN3xIjG1Iww,_KpFfDbw4L1suwxIEtlvRA,https://www.yelp.com/biz/le-potager-du-p%C3%A8re-thierry-paris-2?adjust_creative=Gfp9qSmSlgBP7eaVzQe-WQ&hrid=_KpFfDbw4L1suwxIEtlvRA&utm_campaign=yelp_api_v3&utm_medium=api_v3_business_reviews&utm_source=Gfp9qSmSlgBP7eaVzQe-WQ,"Aloha,

Me and my wife are visiting from Oahu for our anniversary.  

First night here, I searched for someplace that stood out and unique.

Found these...",5,2023-03-10 22:57:54,"{'id': 'hh5eBBgg73q6PDfImryzPw', 'profile_url': 'https://www.yelp.com/user_details?userid=hh5eBBgg73q6PDfImryzPw', 'image_url': 'https://s3-media3.fl.yelpcdn.com/photo/PeSDmi5FI8axYK_nOnEASA/o.jpg', 'name': 'David W.'}"
657yy3D4SwyQN3xIjG1Iww,h8P1mp0-RBcR34hMBZDmYQ,https://www.yelp.com/biz/le-potager-du-p%C3%A8re-thierry-paris-2?adjust_creative=Gfp9qSmSlgBP7eaVzQe-WQ&hrid=h8P1mp0-RBcR34hMBZDmYQ&utm_campaign=yelp_api_v3&utm_medium=api_v3_business_reviews&utm_source=Gfp9qSmSlgBP7eaVzQe-WQ,I just loved the authentic family atmosphere of this homey French restaurant located on a cobbled stone road in Montemarte. We did make sure to get...,5,2023-03-04 21:45:42,"{'id': 'XZaCs-Gs0SXdZgfG38GFYw', 'profile_url': 'https://www.yelp.com/user_details?userid=XZaCs-Gs0SXdZgfG38GFYw', 'image_url': 'https://s3-media3.fl.yelpcdn.com/photo/vmWnTpeVjgDOSnxrshy9BQ/o.jpg', 'name': 'Jessica S.'}"
657yy3D4SwyQN3xIjG1Iww,XgPdHrlVKsDl4d37x8AgTQ,https://www.yelp.com/biz/le-potager-du-p%C3%A8re-thierry-paris-2?adjust_creative=Gfp9qSmSlgBP7eaVzQe-WQ&hrid=XgPdHrlVKsDl4d37x8AgTQ&utm_campaign=yelp_api_v3&utm_medium=api_v3_business_reviews&utm_source=Gfp9qSmSlgBP7eaVzQe-WQ,"Stopped by on a Sunday evening around 7:45pm, was told to come back in an hour. We came back around 9pm and got seated. The foie gras egg dish is as...",5,2023-03-12 10:38:48,"{'id': '3ymyVHTDmxbaKNfOe8xgjw', 'profile_url': 'https://www.yelp.com/user_details?userid=3ymyVHTDmxbaKNfOe8xgjw', 'image_url': 'https://s3-media2.fl.yelpcdn.com/photo/DEVvx1pP7qk0ddaxZOsPfw/o.jpg', 'name': 'Diana J.'}"
DS99xpMkcoH9qCkstWmRAw,k0u7wsmT4WLWkvRPyTaYPg,https://www.yelp.com/biz/septime-paris-2?adjust_creative=Gfp9qSmSlgBP7eaVzQe-WQ&hrid=k0u7wsmT4WLWkvRPyTaYPg&utm_campaign=yelp_api_v3&utm_medium=api_v3_business_reviews&utm_source=Gfp9qSmSlgBP7eaVzQe-WQ,"I was excited when I got the reservation online. It's  definitely do-able. Set the time ahead and refresh right on the dot. 

The restaurant itself is not...",5,2023-03-26 05:36:50,"{'id': 'qnQnrjquwnB87jUjT2rFbg', 'profile_url': 'https://www.yelp.com/user_details?userid=qnQnrjquwnB87jUjT2rFbg', 'image_url': 'https://s3-media3.fl.yelpcdn.com/photo/1jIQcMvlZuKzvf02nP7mOQ/o.jpg', 'name': 'Han L.'}"
DS99xpMkcoH9qCkstWmRAw,PWq4EY48MqJLmOz9k315-A,https://www.yelp.com/biz/septime-paris-2?adjust_creative=Gfp9qSmSlgBP7eaVzQe-WQ&hrid=PWq4EY48MqJLmOz9k315-A&utm_campaign=yelp_api_v3&utm_medium=api_v3_business_reviews&utm_source=Gfp9qSmSlgBP7eaVzQe-WQ,Septime was one of the hardest reservations we have ever tried to secure. We crazily stayed up until 2:00am for an entire week trying to get reservations...,4,2023-02-04 09:32:25,"{'id': 'v6gXn81Orx9x19b6-WcbIA', 'profile_url': 'https://www.yelp.com/user_details?userid=v6gXn81Orx9x19b6-WcbIA', 'image_url': 'https://s3-media2.fl.yelpcdn.com/photo/mrdRojrwq-DScBdWxDXFTA/o.jpg', 'name': 'Johnny N.'}"
DS99xpMkcoH9qCkstWmRAw,waYliMrJb1tt8no1PGYiWg,https://www.yelp.com/biz/septime-paris-2?adjust_creative=Gfp9qSmSlgBP7eaVzQe-WQ&hrid=waYliMrJb1tt8no1PGYiWg&utm_campaign=yelp_api_v3&utm_medium=api_v3_business_reviews&utm_source=Gfp9qSmSlgBP7eaVzQe-WQ,"This is a long overdue review given that we visited in early June, but Septime was one of our favorite meals in Paris. Scoring a reservation was a stressful...",5,2022-12-06 20:28:19,"{'id': 'LYDb1-rtaOZiLn7kEU1lew', 'profile_url': 'https://www.yelp.com/user_details?userid=LYDb1-rtaOZiLn7kEU1lew', 'image_url': 'https://s3-media2.fl.yelpcdn.com/photo/neFSfOG67JHeNQzXB1cTbQ/o.jpg', 'name': 'Audrey M.'}"
4UO8M5flLUR5-TxGdSma0Q,vui4KkAHVi4tMagODnSIQQ,https://www.yelp.com/biz/les-papilles-paris-2?adjust_creative=Gfp9qSmSlgBP7eaVzQe-WQ&hrid=vui4KkAHVi4tMagODnSIQQ&utm_campaign=yelp_api_v3&utm_medium=api_v3_business_reviews&utm_source=Gfp9qSmSlgBP7eaVzQe-WQ,"Friendly, cute, attentive & absolutely delicious!
The escargots were phenomenal -still bubbling when they arrived. We shared the day's market lunch; more...",5,2023-01-31 06:24:08,"{'id': 'eSiJlF6EyrwDiI8DxnXoHA', 'profile_url': 'https://www.yelp.com/user_details?userid=eSiJlF6EyrwDiI8DxnXoHA', 'image_url': 'https://s3-media1.fl.yelpcdn.com/photo/GVgDEeo6CJvehscGu59lrQ/o.jpg', 'name': 'irene l.'}"
4UO8M5flLUR5-TxGdSma0Q,BDdGldTeSKLJ67SfoBjeRA,https://www.yelp.com/biz/les-papilles-paris-2?adjust_creative=Gfp9qSmSlgBP7eaVzQe-WQ&hrid=BDdGldTeSKLJ67SfoBjeRA&utm_campaign=yelp_api_v3&utm_medium=api_v3_business_reviews&utm_source=Gfp9qSmSlgBP7eaVzQe-WQ,I booked a reservation for this place 2 months in advance just because I wanted to take my mom to a nice French restaurant while we were in Paris. It was a...,3,2022-08-30 19:22:12,"{'id': 'RbdoFTmZkvo64TPhm_OzEg', 'profile_url': 'https://www.yelp.com/user_details?userid=RbdoFTmZkvo64TPhm_OzEg', 'image_url': 'https://s3-media4.fl.yelpcdn.com/photo/Oy-OS94Gg9ECQJETl8GLog/o.jpg', 'name': 'Cindy C.'}"
4UO8M5flLUR5-TxGdSma0Q,qagfa7uMHMS33Ir6WscPuQ,https://www.yelp.com/biz/les-papilles-paris-2?adjust_creative=Gfp9qSmSlgBP7eaVzQe-WQ&hrid=qagfa7uMHMS33Ir6WscPuQ&utm_campaign=yelp_api_v3&utm_medium=api_v3_business_reviews&utm_source=Gfp9qSmSlgBP7eaVzQe-WQ,"Great fresh food. We had the fixed price menu which included a broccoli soup that you pour over tasty croutons, bacon, fresh cream cheese and other...",5,2022-07-23 20:04:49,"{'id': 'RRJ8eyyj8eM4qEfwBBqHEQ', 'profile_url': 'https://www.yelp.com/user_details?userid=RRJ8eyyj8eM4qEfwBBqHEQ', 'image_url': 'https://s3-media2.fl.yelpcdn.com/photo/JPKKKx5pT3IN7aqVLCHCaA/o.jpg', 'name': 'Bruce C.'}"
YRMHyCvqMz_lLgpqjNj_tw,tGRcu9_TeuHV0vFGShZN8Q,https://www.yelp.com/biz/la-droguerie-du-marais-paris?adjust_creative=Gfp9qSmSlgBP7eaVzQe-WQ&hrid=tGRcu9_TeuHV0vFGShZN8Q&utm_campaign=yelp_api_v3&utm_medium=api_v3_business_reviews&utm_source=Gfp9qSmSlgBP7eaVzQe-WQ,This small shop serves my favorite crepes in Paris! Hubby discovered this spot a couple of years ago and he we had a savory and sweet crepe almost every day...,5,2021-12-25 16:28:09,"{'id': 'nlRnQYy2U2BwybI-OEwdfQ', 'profile_url': 'https://www.yelp.com/user_details?userid=nlRnQYy2U2BwybI-OEwdfQ', 'image_url': 'https://s3-media3.fl.yelpcdn.com/photo/7BMhivi_snvZiPlwzS5tKA/o.jpg', 'name': 'Love K.'}"
YRMHyCvqMz_lLgpqjNj_tw,ydoPnFl_D1nftl6nvARAsQ,https://www.yelp.com/biz/la-droguerie-du-marais-paris?adjust_creative=Gfp9qSmSlgBP7eaVzQe-WQ&hrid=ydoPnFl_D1nftl6nvARAsQ&utm_campaign=yelp_api_v3&utm_medium=api_v3_business_reviews&utm_source=Gfp9qSmSlgBP7eaVzQe-WQ,"this place is DELECTABLE. BEST CREPES IN PARIS!!! they have savory and sweet options, both far exceeded our expectations. the man running it (by himself)...",5,2022-06-14 14:48:35,"{'id': 'TdfrUECFq1xTY1jMx5Ohxg', 'profile_url': 'https://www.yelp.com/user_details?userid=TdfrUECFq1xTY1jMx5Ohxg', 'image_url': None, 'name': 'Frankie S.'}"
YRMHyCvqMz_lLgpqjNj_tw,B3fibWu1vIgXhF7c-EOeHg,https://www.yelp.com/biz/la-droguerie-du-marais-paris?adjust_creative=Gfp9qSmSlgBP7eaVzQe-WQ&hrid=B3fibWu1vIgXhF7c-EOeHg&utm_campaign=yelp_api_v3&utm_medium=api_v3_business_reviews&utm_source=Gfp9qSmSlgBP7eaVzQe-WQ,La Droguerie du Marais serves up the very BEST crepes in all of Paris.  It's a small shop with maybe 2 or 3 tables inside.  Most people get the crepes to...,5,2020-02-27 06:03:06,"{'id': '7W-p-PJlmrzg0mk3pWKoyQ', 'profile_url': 'https://www.yelp.com/user_details?userid=7W-p-PJlmrzg0mk3pWKoyQ', 'image_url': 'https://s3-media4.fl.yelpcdn.com/photo/NRhr2jkuInRlRaYfgvVmfw/o.jpg', 'name': 'Arshad H.'}"
j2mUHWVXSKSkEuHJao_wKg,duwH-BK3wH1XtYRhvgNAUw,https://www.yelp.com/biz/shakespeare-and-company-paris?adjust_creative=Gfp9qSmSlgBP7eaVzQe-WQ&hrid=duwH-BK3wH1XtYRhvgNAUw&utm_campaign=yelp_api_v3&utm_medium=api_v3_business_reviews&utm_source=Gfp9qSmSlgBP7eaVzQe-WQ,"Books and more books.
A fascination old building.
Friendly staff.
We came, we browsed, we bought.

Paris is lucky to have this store.",5,2023-04-26 23:54:41,"{'id': 'DkJya-j5ZPxygeusMoc5yQ', 'profile_url': 'https://www.yelp.com/user_details?userid=DkJya-j5ZPxygeusMoc5yQ', 'image_url': 'https://s3-media4.fl.yelpcdn.com/photo/sWyd1OUXKXe1dYjY2UJycg/o.jpg', 'name': 'Dave B.'}"
j2mUHWVXSKSkEuHJao_wKg,ptp6JHRx7USdFa4QCvxHHQ,https://www.yelp.com/biz/shakespeare-and-company-paris?adjust_creative=Gfp9qSmSlgBP7eaVzQe-WQ&hrid=ptp6JHRx7USdFa4QCvxHHQ&utm_campaign=yelp_api_v3&utm_medium=api_v3_business_reviews&utm_source=Gfp9qSmSlgBP7eaVzQe-WQ,"I'm a bibliophile.

Consequently, whenever and wherever I go somewhere, visiting a bookstore is typically on the agenda.

It's entirely possibly that before...",5,2023-01-27 11:32:48,"{'id': 'n7VTcg4-F94ziJ4eRERSdw', 'profile_url': 'https://www.yelp.com/user_details?userid=n7VTcg4-F94ziJ4eRERSdw', 'image_url': 'https://s3-media3.fl.yelpcdn.com/photo/j0MuDnCcOKLdAR7sfxp7aA/o.jpg', 'name': 'Marilu F.'}"
j2mUHWVXSKSkEuHJao_wKg,3n2ldAP8KV7To782yWba6w,https://www.yelp.com/biz/shakespeare-and-company-paris?adjust_creative=Gfp9qSmSlgBP7eaVzQe-WQ&hrid=3n2ldAP8KV7To782yWba6w&utm_campaign=yelp_api_v3&utm_medium=api_v3_business_reviews&utm_source=Gfp9qSmSlgBP7eaVzQe-WQ,"Aww, the most famous bookstore in Paris!  So much in a small space, yet the layout provides a ""homie"" feeling.  Every topic/category has a section, even if...",5,2022-12-22 18:38:12,"{'id': 't6vGehUyQk1ibU5byNRFKw', 'profile_url': 'https://www.yelp.com/user_details?userid=t6vGehUyQk1ibU5byNRFKw', 'image_url': 'https://s3-media3.fl.yelpcdn.com/photo/4wLQRqz3HJsgVcysIBsozw/o.jpg', 'name': 'Debbie F.'}"
weiNgy7k32W5fmZoTaF-Bw,ppuPZuTqzCJ2sWRvidDzXg,https://www.yelp.com/biz/l-ange-20-paris-2?adjust_creative=Gfp9qSmSlgBP7eaVzQe-WQ&hrid=ppuPZuTqzCJ2sWRvidDzXg&utm_campaign=yelp_api_v3&utm_medium=api_v3_business_reviews&utm_source=Gfp9qSmSlgBP7eaVzQe-WQ,"Awesome place staff, kitchen and everyone was great. Just stumbled upon it and it was the best meal we had in Paris!",5,2023-03-27 10:16:14,"{'id': '5pDM-nAj_ElJLGJOF5tL_A', 'profile_url': 'https://www.yelp.com/user_details?userid=5pDM-nAj_ElJLGJOF5tL_A', 'image_url': 'https://s3-media4.fl.yelpcdn.com/photo/V24UN7Bg-EtTGWUz6cLJ6Q/o.jpg', 'name': 'Craig H.'}"
weiNgy7k32W5fmZoTaF-Bw,znONekPmm_nj1vvvTg4Yfg,https://www.yelp.com/biz/l-ange-20-paris-2?adjust_creative=Gfp9qSmSlgBP7eaVzQe-WQ&hrid=znONekPmm_nj1vvvTg4Yfg&utm_campaign=yelp_api_v3&utm_medium=api_v3_business_reviews&utm_source=Gfp9qSmSlgBP7eaVzQe-WQ,"Really good restaurant with fabulous food. Best to have a reservation as it's small and nearly always busy. Service is good. 
The duck terrine is absolutely...",4,2023-04-22 06:37:39,"{'id': 'Gqaz4bnPl3My6TCRpXX_vA', 'profile_url': 'https://www.yelp.com/user_details?userid=Gqaz4bnPl3My6TCRpXX_vA', 'image_url': 'https://s3-media2.fl.yelpcdn.com/photo/nt9LdDgmKU8C-Y-Cmo3AeQ/o.jpg', 'name': 'Mark J.'}"
weiNgy7k32W5fmZoTaF-Bw,rfhyEfpdZGMx3gN2ncTmZQ,https://www.yelp.com/biz/l-ange-20-paris-2?adjust_creative=Gfp9qSmSlgBP7eaVzQe-WQ&hrid=rfhyEfpdZGMx3gN2ncTmZQ&utm_campaign=yelp_api_v3&utm_medium=api_v3_business_reviews&utm_source=Gfp9qSmSlgBP7eaVzQe-WQ,"We came here for dinner on our first night in Paris after our friend recommended it and I'm glad we did, we made our reservation earlier in the day and we...",5,2023-01-13 09:02:13,"{'id': 'dXOV0wBcViWf7TYvy2ItbA', 'profile_url': 'https://www.yelp.com/user_details?userid=dXOV0wBcViWf7TYvy2ItbA', 'image_url': 'https://s3-media3.fl.yelpcdn.com/photo/5q-oJUyscNUOHAVYa1leig/o.jpg', 'name': 'Jerry L.'}"
aPLSj-9aNHSQpi7Sf5_9hA,8HcJlW2LoFADR1nnb9AP5g,https://www.yelp.com/biz/le-comptoir-paris-18?adjust_creative=Gfp9qSmSlgBP7eaVzQe-WQ&hrid=8HcJlW2LoFADR1nnb9AP5g&utm_campaign=yelp_api_v3&utm_medium=api_v3_business_reviews&utm_source=Gfp9qSmSlgBP7eaVzQe-WQ,"Le Comptoir was recommended to me by a friend. I was absolutely starving, so I quickly asked her for a recommendation on what to get and she told me to get...",4,2023-06-08 17:14:42,"{'id': 'JPSTwAFTldiMtxob28jo1A', 'profile_url': 'https://www.yelp.com/user_details?userid=JPSTwAFTldiMtxob28jo1A', 'image_url': 'https://s3-media1.fl.yelpcdn.com/photo/mwJi8yN4psunzJDG9JHtvg/o.jpg', 'name': 'Matea P.'}"
aPLSj-9aNHSQpi7Sf5_9hA,iOrJdcTvLXZhAvfIdfdXWQ,https://www.yelp.com/biz/le-comptoir-paris-18?adjust_creative=Gfp9qSmSlgBP7eaVzQe-WQ&hrid=iOrJdcTvLXZhAvfIdfdXWQ&utm_campaign=yelp_api_v3&utm_medium=api_v3_business_reviews&utm_source=Gfp9qSmSlgBP7eaVzQe-WQ,Nothing wrong with it but I cannot understand the hype. The steak tartar was memorable. I love the bold use of scallion. The texture of the beef was...,4,2023-05-02 11:17:23,"{'id': 'SXeTMMXQ3J-wEPBIRJr72Q', 'profile_url': 'https://www.yelp.com/user_details?userid=SXeTMMXQ3J-wEPBIRJr72Q', 'image_url': 'https://s3-media3.fl.yelpcdn.com/photo/I2tSi2gBP9TnnvVSk73mVw/o.jpg', 'name': 'Eva C.'}"
aPLSj-9aNHSQpi7Sf5_9hA,M8OX4k6LuiDIiP1qsmTiig,https://www.yelp.com/biz/le-comptoir-paris-18?adjust_creative=Gfp9qSmSlgBP7eaVzQe-WQ&hrid=M8OX4k6LuiDIiP1qsmTiig&utm_campaign=yelp_api_v3&utm_medium=api_v3_business_reviews&utm_source=Gfp9qSmSlgBP7eaVzQe-WQ,"""A good find in a touristy area""

I was expecting a lot less when I came here.  I was thinking from all of the reviews that it was going to be very average...",4,2022-09-25 12:28:10,"{'id': '6VbFaYbtITwMzuCOj8567A', 'profile_url': 'https://www.yelp.com/user_details?userid=6VbFaYbtITwMzuCOj8567A', 'image_url': 'https://s3-media3.fl.yelpcdn.com/photo/YkkkfT5DW6CU3Eq0uqAZ4A/o.jpg', 'name': 'Brion R.'}"
aveslz7waP99LSjW_MnLBw,IWyOb7XufKXqzVuJc_TdqQ,https://www.yelp.com/biz/le-caf%C3%A9-paris-5?adjust_creative=Gfp9qSmSlgBP7eaVzQe-WQ&hrid=IWyOb7XufKXqzVuJc_TdqQ&utm_campaign=yelp_api_v3&utm_medium=api_v3_business_reviews&utm_source=Gfp9qSmSlgBP7eaVzQe-WQ,Update:  My son had the burger with grilled onions and foie gras here in 2017 and still raves about it as the best burger he's ever had in his life!  I...,5,2022-09-11 10:44:49,"{'id': 'tctoFsg9byYvQ7OhdfzrvQ', 'profile_url': 'https://www.yelp.com/user_details?userid=tctoFsg9byYvQ7OhdfzrvQ', 'image_url': 'https://s3-media4.fl.yelpcdn.com/photo/82V6JN1r6_S2RmHN7wqzUA/o.jpg', 'name': 'Paul O.'}"
aveslz7waP99LSjW_MnLBw,OaIOzsxRtYCwKfPK16_MGw,https://www.yelp.com/biz/le-caf%C3%A9-paris-5?adjust_creative=Gfp9qSmSlgBP7eaVzQe-WQ&hrid=OaIOzsxRtYCwKfPK16_MGw&utm_campaign=yelp_api_v3&utm_medium=api_v3_business_reviews&utm_source=Gfp9qSmSlgBP7eaVzQe-WQ,"All around great experience. Extensive drink selection,   Delicious and authentic food, friendly staff, pleasant environment. It was nice to dine in a cafe...",5,2022-12-01 06:37:12,"{'id': 'Wakg4OeyUe_0F4vQzT984g', 'profile_url': 'https://www.yelp.com/user_details?userid=Wakg4OeyUe_0F4vQzT984g', 'image_url': 'https://s3-media1.fl.yelpcdn.com/photo/Noe_Rslif-F4fyGcZdSAjg/o.jpg', 'name': 'Ryan D.'}"
aveslz7waP99LSjW_MnLBw,uZWMjoq3DM5k_Hpcu0TPXQ,https://www.yelp.com/biz/le-caf%C3%A9-paris-5?adjust_creative=Gfp9qSmSlgBP7eaVzQe-WQ&hrid=uZWMjoq3DM5k_Hpcu0TPXQ&utm_campaign=yelp_api_v3&utm_medium=api_v3_business_reviews&utm_source=Gfp9qSmSlgBP7eaVzQe-WQ,"If I'm ever stuck inside because of rain, sleet, or zombie apocalypse, I want it to be at this cafe.

Service in Europe can often be slower than some...",4,2017-10-25 06:01:13,"{'id': 'ITa3vh5ERI90G_WP4SmGUQ', 'profile_url': 'https://www.yelp.com/user_details?userid=ITa3vh5ERI90G_WP4SmGUQ', 'image_url': 'https://s3-media1.fl.yelpcdn.com/photo/D9oIA48dPiXTeLrAnXoSNg/o.jpg', 'name': 'Peter D.'}"
mJMW4j5IYYhbWaBySCPATA,MUExcpyLqHOahwR0itjmyw,https://www.yelp.com/biz/loulou-paris?adjust_creative=Gfp9qSmSlgBP7eaVzQe-WQ&hrid=MUExcpyLqHOahwR0itjmyw&utm_campaign=yelp_api_v3&utm_medium=api_v3_business_reviews&utm_source=Gfp9qSmSlgBP7eaVzQe-WQ,"Amazing food and gorgeous view of the Eiffel Tower! Must get reservations or risk waiting. 

The truffle pasta and pizza is a must try!!",5,2022-12-20 18:36:17,"{'id': '0TJ5eaK-czHRTxVDC6vKBA', 'profile_url': 'https://www.yelp.com/user_details?userid=0TJ5eaK-czHRTxVDC6vKBA', 'image_url': 'https://s3-media3.fl.yelpcdn.com/photo/q0J0zGNjGnl3bXuoHPwtKw/o.jpg', 'name': 'Kris H.'}"
mJMW4j5IYYhbWaBySCPATA,-X8tXL_Vc9I4KSTXxjmD7Q,https://www.yelp.com/biz/loulou-paris?adjust_creative=Gfp9qSmSlgBP7eaVzQe-WQ&hrid=-X8tXL_Vc9I4KSTXxjmD7Q&utm_campaign=yelp_api_v3&utm_medium=api_v3_business_reviews&utm_source=Gfp9qSmSlgBP7eaVzQe-WQ,Best pasta I've ever had. Cooked perfectly. Seasoned perfectly. The creamy sauce was S-tier. Pizza was good but the pasta overshadowed everything.,5,2022-11-12 15:49:08,"{'id': 'cVIaUWp7ZSPdfnQ3ipZncQ', 'profile_url': 'https://www.yelp.com/user_details?userid=cVIaUWp7ZSPdfnQ3ipZncQ', 'image_url': 'https://s3-media2.fl.yelpcdn.com/photo/oTWVeUY4hvLEDpWEwco8qA/o.jpg', 'name': 'Marc R.'}"
mJMW4j5IYYhbWaBySCPATA,jOWhGZ4NeUHJpIVCTlGShQ,https://www.yelp.com/biz/loulou-paris?adjust_creative=Gfp9qSmSlgBP7eaVzQe-WQ&hrid=jOWhGZ4NeUHJpIVCTlGShQ&utm_campaign=yelp_api_v3&utm_medium=api_v3_business_reviews&utm_source=Gfp9qSmSlgBP7eaVzQe-WQ,"LouLou was honestly a little bit disappointing. Before my trip to Paris, I heard so many good things from others and online. The reservation was hard to...",3,2022-08-01 19:00:26,"{'id': 'PxGYXVB_YilH7sBlvzmw4g', 'profile_url': 'https://www.yelp.com/user_details?userid=PxGYXVB_YilH7sBlvzmw4g', 'image_url': 'https://s3-media2.fl.yelpcdn.com/photo/j1c6ILzfkgthRP49cZ7BQg/o.jpg', 'name': 'Kayhan J.'}"
TYDSdXOJU-07rZgRFdZYEA,weWGOmRIS6pgDfe0SzTMrQ,https://www.yelp.com/biz/bien-%C3%A9lev%C3%A9-paris?adjust_creative=Gfp9qSmSlgBP7eaVzQe-WQ&hrid=weWGOmRIS6pgDfe0SzTMrQ&utm_campaign=yelp_api_v3&utm_medium=api_v3_business_reviews&utm_source=Gfp9qSmSlgBP7eaVzQe-WQ,"One of the best steaks I've ever had, and I've been to most of the top NYC steakhouses. Cooked perfectly with caramelized fat and charred on the outside,...",5,2021-10-08 20:51:45,"{'id': 'fWpP44IUmeQ0aslD4RKJrw', 'profile_url': 'https://www.yelp.com/user_details?userid=fWpP44IUmeQ0aslD4RKJrw', 'image_url': 'https://s3-media3.fl.yelpcdn.com/photo/MAVWKZlAjOQE93IMcUxjow/o.jpg', 'name': 'Joe S.'}"
TYDSdXOJU-07rZgRFdZYEA,2s72A7X-lJyHN6N_YA9r9g,https://www.yelp.com/biz/bien-%C3%A9lev%C3%A9-paris?adjust_creative=Gfp9qSmSlgBP7eaVzQe-WQ&hrid=2s72A7X-lJyHN6N_YA9r9g&utm_campaign=yelp_api_v3&utm_medium=api_v3_business_reviews&utm_source=Gfp9qSmSlgBP7eaVzQe-WQ,"Food: excellent, wonderfully cooked dishes with a solid line of wine offerings. We were very pleased with our orders in terms of presentation and quality....",4,2017-08-27 18:20:43,"{'id': 'yEnhx8laIkg8NiFJlLBh2g', 'profile_url': 'https://www.yelp.com/user_details?userid=yEnhx8laIkg8NiFJlLBh2g', 'image_url': 'https://s3-media4.fl.yelpcdn.com/photo/PLwk0Yp6Jqs5DPeCQDVWOg/o.jpg', 'name': 'C. E.'}"
