restaurant_id,id,url,text,rating,time_created,user
3drmuEM-hbUqOXVmZRtF4g,8R_7IFpCxKOdU2KCAlui-A,https://www.yelp.com/biz/freddys-paris?adjust_creative=Gfp9qSmSlgBP7eaVzQe-WQ&hrid=8R_7IFpCxKOdU2KCAlui-A&utm_campaign=yelp_api_v3&utm_medium=api_v3_business_reviews&utm_source=Gfp9qSmSlgBP7eaVzQe-WQ,Freddy's was a great recommendation by my mother. I finally let her choose the place for dinner and she made a great choice. You could already tell it was...,5,2022-11-23 15:34:37,"{'id': 'UV7kaa4uBsHATHdAvbE6aw', 'profile_url': 'https://www.yelp.com/user_details?userid=UV7kaa4uBsHATHdAvbE6aw', 'image_url': 'https://s3-media3.fl.yelpcdn.com/photo/eGd1VwdgVxMch13KCoWySQ/o.jpg', 'name': 'Alden C.'}"
59YEvrt18qxxfq0wbgT-cg,5RFtaf7sP39QsdlO3vS3AQ,https://www.yelp.com/biz/little-breizh-paris?adjust_creative=Gfp9qSmSlgBP7eaVzQe-WQ&hrid=5RFtaf7sP39QsdlO3vS3AQ&utm_campaign=yelp_api_v3&utm_medium=api_v3_business_reviews&utm_source=Gfp9qSmSlgBP7eaVzQe-WQ,Great creperie. Have been here during previous years and it has maintained its greatness. Arrived and there was a waiting line down the street. It moved...,5,2023-06-08 08:50:49,"{'id': 'opB_Mh00hL1SWGTfvbLKig', 'profile_url': 'https://www.yelp.com/user_details?userid=opB_Mh00hL1SWGTfvbLKig', 'image_url': 'https://s3-media2.fl.yelpcdn.com/photo/PytNy9vl1yTx7bi7YsYkRQ/o.jpg', 'name': 'Lou E.'}"
59YEvrt18qxxfq0wbgT-cg,zy_qysgqEB98KnMNk2FmmA,https://www.yelp.com/biz/little-breizh-paris?adjust_creative=Gfp9qSmSlgBP7eaVzQe-WQ&hrid=zy_qysgqEB98KnMNk2FmmA&utm_campaign=yelp_api_v3&utm_medium=api_v3_business_reviews&utm_source=Gfp9qSmSlgBP7eaVzQe-WQ,"さすが人気店、という印象。
ガレット、クレープともに適格な温かさで出されて、美味しくいただきました。
注文したガレットの具沢山チーズ、ほうれん草、卵に驚き、クレープの前にすでに満腹。
ランチのセットはお得感が素晴らしい。

サービスがフレンドリーで、忙しい中でも世話好きな感じのマダムとムッシュから、温かいおもてな...",5,2023-04-05 01:09:40,"{'id': 'rUJLA45RGzOrlALZ1muDbQ', 'profile_url': 'https://www.yelp.com/user_details?userid=rUJLA45RGzOrlALZ1muDbQ', 'image_url': 'https://s3-media1.fl.yelpcdn.com/photo/XioupnoUjSMGbgT2D-pBMQ/o.jpg', 'name': 'Y S L.'}"
59YEvrt18qxxfq0wbgT-cg,lSVj-qzmzByFj-5R2nppsg,https://www.yelp.com/biz/little-breizh-paris?adjust_creative=Gfp9qSmSlgBP7eaVzQe-WQ&hrid=lSVj-qzmzByFj-5R2nppsg&utm_campaign=yelp_api_v3&utm_medium=api_v3_business_reviews&utm_source=Gfp9qSmSlgBP7eaVzQe-WQ,Amazing crepes and friendly service. Be sure to try the house-made cider! We were only in Paris four nights and were tempted to return a second time.,5,2023-03-12 07:56:54,"{'id': 'C1DnuQeayHYEXDguTA3E9g', 'profile_url': 'https://www.yelp.com/user_details?userid=C1DnuQeayHYEXDguTA3E9g', 'image_url': 'https://s3-media3.fl.yelpcdn.com/photo/ggXv-RUcZVHP2YH4HLTI8g/o.jpg', 'name': 'Sue M.'}"
snqZMUD_7QynNpH_BJhrkw,Kgh53LMY4Z1e6LYNMN2muQ,https://www.yelp.com/biz/essaouira-paris?adjust_creative=Gfp9qSmSlgBP7eaVzQe-WQ&hrid=Kgh53LMY4Z1e6LYNMN2muQ&utm_campaign=yelp_api_v3&utm_medium=api_v3_business_reviews&utm_source=Gfp9qSmSlgBP7eaVzQe-WQ,"I was trying to find my review for Essaouira and didn't realize I didn't write one? So, disclaimer that this review is from when we had dinner here years...",5,2022-12-11 15:20:17,"{'id': '-AJV31rH5tZmKI0f0rlQnA', 'profile_url': 'https://www.yelp.com/user_details?userid=-AJV31rH5tZmKI0f0rlQnA', 'image_url': 'https://s3-media1.fl.yelpcdn.com/photo/6O0JKfcVGnyf9ABf7qf8gA/o.jpg', 'name': 'Starr C.'}"
snqZMUD_7QynNpH_BJhrkw,RKTVeMJFLT7-mRQNuh6kCQ,https://www.yelp.com/biz/essaouira-paris?adjust_creative=Gfp9qSmSlgBP7eaVzQe-WQ&hrid=RKTVeMJFLT7-mRQNuh6kCQ&utm_campaign=yelp_api_v3&utm_medium=api_v3_business_reviews&utm_source=Gfp9qSmSlgBP7eaVzQe-WQ,Extremely authentic decor for this place near Trocadéro. Moroccan food was the craving. We had the salad as a starter and kefta meatballs with eggs in a...,3,2023-01-22 14:14:35,"{'id': 'G-DzOxoh7tniSa5K7apy-g', 'profile_url': 'https://www.yelp.com/user_details?userid=G-DzOxoh7tniSa5K7apy-g', 'image_url': 'https://s3-media2.fl.yelpcdn.com/photo/phM8PXHjmqd-7XJhagkUOQ/o.jpg', 'name': 'Mark B.'}"
snqZMUD_7QynNpH_BJhrkw,jGwU83Nr9aLRR8zbu2lwsQ,https://www.yelp.com/biz/essaouira-paris?adjust_creative=Gfp9qSmSlgBP7eaVzQe-WQ&hrid=jGwU83Nr9aLRR8zbu2lwsQ&utm_campaign=yelp_api_v3&utm_medium=api_v3_business_reviews&utm_source=Gfp9qSmSlgBP7eaVzQe-WQ,What a delight! Made a reservation for a group of 8 with only a one-day notice and they not only seated us all together in a Beautiful room but served us...,5,2023-05-29 12:42:49,"{'id': 'A4QtvRAQvfVUVXVM7fYRNg', 'profile_url': 'https://www.yelp.com/user_details?userid=A4QtvRAQvfVUVXVM7fYRNg', 'image_url': None, 'name': 'Nancy D.'}"
g9Czar9Jr5s6V_hW6YfErQ,1VTAOtSxMODG2q5yvhgoug,https://www.yelp.com/biz/le-bistrot-de-paris-paris-3?adjust_creative=Gfp9qSmSlgBP7eaVzQe-WQ&hrid=1VTAOtSxMODG2q5yvhgoug&utm_campaign=yelp_api_v3&utm_medium=api_v3_business_reviews&utm_source=Gfp9qSmSlgBP7eaVzQe-WQ,"Another perfect Bistro.
In the 7th, one block from the Seine on a quiet street lies Le Bistrot de Paris, a beautiful period restaurant serving classic...",5,2023-05-24 06:55:55,"{'id': 'wrMz3KwPYEHcDLH5SW4lUA', 'profile_url': 'https://www.yelp.com/user_details?userid=wrMz3KwPYEHcDLH5SW4lUA', 'image_url': 'https://s3-media3.fl.yelpcdn.com/photo/KbDy9V0RCO935iAK1i_xoA/o.jpg', 'name': 'John C.'}"
g9Czar9Jr5s6V_hW6YfErQ,Hq-qgBDJ7V7a3eHQUg_uHg,https://www.yelp.com/biz/le-bistrot-de-paris-paris-3?adjust_creative=Gfp9qSmSlgBP7eaVzQe-WQ&hrid=Hq-qgBDJ7V7a3eHQUg_uHg&utm_campaign=yelp_api_v3&utm_medium=api_v3_business_reviews&utm_source=Gfp9qSmSlgBP7eaVzQe-WQ,Excellent bistro with good service and excellent service. We enjoyed the confit de canard. Be sure to check the wine list. We did a 2018 Morgan which was...,5,2022-11-22 14:59:51,"{'id': 'jpvMnToAIQtcw-dNi5EUkw', 'profile_url': 'https://www.yelp.com/user_details?userid=jpvMnToAIQtcw-dNi5EUkw', 'image_url': 'https://s3-media1.fl.yelpcdn.com/photo/3mgPr94ms9GdpmJIF3nuiw/o.jpg', 'name': 'Rich V.'}"
g9Czar9Jr5s6V_hW6YfErQ,m_yLrhWspNIS2OaXnctJJg,https://www.yelp.com/biz/le-bistrot-de-paris-paris-3?adjust_creative=Gfp9qSmSlgBP7eaVzQe-WQ&hrid=m_yLrhWspNIS2OaXnctJJg&utm_campaign=yelp_api_v3&utm_medium=api_v3_business_reviews&utm_source=Gfp9qSmSlgBP7eaVzQe-WQ,"If I had a magic carpet that could take me and one girl of my choice across the ocean so we could have lunch, I would take pin-up sexy Dwarf model Karina...",5,2022-08-17 14:58:18,"{'id': 'S7VG3vBUtJDLKX_ewbc15A', 'profile_url': 'https://www.yelp.com/user_details?userid=S7VG3vBUtJDLKX_ewbc15A', 'image_url': 'https://s3-media3.fl.yelpcdn.com/photo/vhiRiYEZG4J3NmyvPb7Tiw/o.jpg', 'name': 'Eric F.'}"
eV3XeyDMWwT0E8o8nYodRQ,KBnNGx0ee8wHJY_PrwQcjw,https://www.yelp.com/biz/au-pied-de-cochon-paris-2?adjust_creative=Gfp9qSmSlgBP7eaVzQe-WQ&hrid=KBnNGx0ee8wHJY_PrwQcjw&utm_campaign=yelp_api_v3&utm_medium=api_v3_business_reviews&utm_source=Gfp9qSmSlgBP7eaVzQe-WQ,"We found this great little restaurant while walking from the 5th Arrondissement to E. Dehillerin, and we decided to stop for lunch. We started with six...",5,2023-06-04 13:20:22,"{'id': 'VTpTPA9arK7HELfksHqnlg', 'profile_url': 'https://www.yelp.com/user_details?userid=VTpTPA9arK7HELfksHqnlg', 'image_url': 'https://s3-media2.fl.yelpcdn.com/photo/9paBAb3xdsTzlC1-oZ-tAg/o.jpg', 'name': 'Lynda T.'}"
eV3XeyDMWwT0E8o8nYodRQ,-J8EHy3AOXVCksPpvzL03A,https://www.yelp.com/biz/au-pied-de-cochon-paris-2?adjust_creative=Gfp9qSmSlgBP7eaVzQe-WQ&hrid=-J8EHy3AOXVCksPpvzL03A&utm_campaign=yelp_api_v3&utm_medium=api_v3_business_reviews&utm_source=Gfp9qSmSlgBP7eaVzQe-WQ,"The Temple of Pig!!!
Pork Rillette
Saucisson
Pork Croquettes
And a giant pork chop for two -- which could easily feed 3-4.

All fabulous!

Word to the wise;...",5,2023-05-25 12:45:22,"{'id': 'wrMz3KwPYEHcDLH5SW4lUA', 'profile_url': 'https://www.yelp.com/user_details?userid=wrMz3KwPYEHcDLH5SW4lUA', 'image_url': 'https://s3-media3.fl.yelpcdn.com/photo/KbDy9V0RCO935iAK1i_xoA/o.jpg', 'name': 'John C.'}"
eV3XeyDMWwT0E8o8nYodRQ,u2bDSbEexq1PuOeywiw4tQ,https://www.yelp.com/biz/au-pied-de-cochon-paris-2?adjust_creative=Gfp9qSmSlgBP7eaVzQe-WQ&hrid=u2bDSbEexq1PuOeywiw4tQ&utm_campaign=yelp_api_v3&utm_medium=api_v3_business_reviews&utm_source=Gfp9qSmSlgBP7eaVzQe-WQ,"We decided to go to this restaurant based a review in Eater, but since it has been around since 1947,  I was a bit worried it may be just running on its...",5,2023-01-05 12:35:20,"{'id': 'HbcPnro2jAJHdJx2bYIldQ', 'profile_url': 'https://www.yelp.com/user_details?userid=HbcPnro2jAJHdJx2bYIldQ', 'image_url': 'https://s3-media2.fl.yelpcdn.com/photo/0lzcd9VOfxxmcNxH77G0eQ/o.jpg', 'name': 'Mary G.'}"
E3PvQMOiAnCVTUgPSU1mJQ,DP1qb-GdJN0sl2w-nfZSUA,https://www.yelp.com/biz/le-volant-basque-paris?adjust_creative=Gfp9qSmSlgBP7eaVzQe-WQ&hrid=DP1qb-GdJN0sl2w-nfZSUA&utm_campaign=yelp_api_v3&utm_medium=api_v3_business_reviews&utm_source=Gfp9qSmSlgBP7eaVzQe-WQ,"Outstanding food. We had the 3 course meal for 35e. Mushroom soup, veal and beef burgundy for mains and chocolate mousse for dessert. All were excellent....",5,2023-06-09 13:14:05,"{'id': '3mOFHs5p1b77ibp8ku7UQA', 'profile_url': 'https://www.yelp.com/user_details?userid=3mOFHs5p1b77ibp8ku7UQA', 'image_url': 'https://s3-media4.fl.yelpcdn.com/photo/4gtIagVl132wFDZ6GsPMgQ/o.jpg', 'name': 'Kurt R.'}"
E3PvQMOiAnCVTUgPSU1mJQ,H8BZG6YgTtS-_B3bD-KCZA,https://www.yelp.com/biz/le-volant-basque-paris?adjust_creative=Gfp9qSmSlgBP7eaVzQe-WQ&hrid=H8BZG6YgTtS-_B3bD-KCZA&utm_campaign=yelp_api_v3&utm_medium=api_v3_business_reviews&utm_source=Gfp9qSmSlgBP7eaVzQe-WQ,"I found this place on Yelp and it had great reviews so we decided to give it a shot. Actually, what's funny is we thought this was a different place closer...",4,2022-12-21 00:59:52,"{'id': 'mnGFjFvh5E_e8bZL1L5A9g', 'profile_url': 'https://www.yelp.com/user_details?userid=mnGFjFvh5E_e8bZL1L5A9g', 'image_url': 'https://s3-media4.fl.yelpcdn.com/photo/-EAWulCm317dHTZGtjxC3A/o.jpg', 'name': 'Jerry L.'}"
E3PvQMOiAnCVTUgPSU1mJQ,psSXvgOFANYhkiLEqGa7AA,https://www.yelp.com/biz/le-volant-basque-paris?adjust_creative=Gfp9qSmSlgBP7eaVzQe-WQ&hrid=psSXvgOFANYhkiLEqGa7AA&utm_campaign=yelp_api_v3&utm_medium=api_v3_business_reviews&utm_source=Gfp9qSmSlgBP7eaVzQe-WQ,Amazing French cuisine with reasonable prices. But staff seemed annoyed that we didn't make a reservation. They weren't that busy when we went... tables...,4,2022-12-30 09:00:32,"{'id': 'Bgk4RXeHrHBTT52QuHQ-2Q', 'profile_url': 'https://www.yelp.com/user_details?userid=Bgk4RXeHrHBTT52QuHQ-2Q', 'image_url': 'https://s3-media1.fl.yelpcdn.com/photo/9upkh_tK428hu1UfyZA60A/o.jpg', 'name': 'Natalie T.'}"
36bmPjOYLp6-Ql_IEiSQUw,NRsEtnheSO_56ALcexyvSg,https://www.yelp.com/biz/sacr%C3%A9-frenchy-paris-2?adjust_creative=Gfp9qSmSlgBP7eaVzQe-WQ&hrid=NRsEtnheSO_56ALcexyvSg&utm_campaign=yelp_api_v3&utm_medium=api_v3_business_reviews&utm_source=Gfp9qSmSlgBP7eaVzQe-WQ,Amazing amazing dinner! We decided to get off at the Chatalet stop to check out the restaurants for dinner. We didn't have a set place in mind--just...,5,2023-06-03 14:40:19,"{'id': '1keSzYrEUFfCNKJjB4MduA', 'profile_url': 'https://www.yelp.com/user_details?userid=1keSzYrEUFfCNKJjB4MduA', 'image_url': 'https://s3-media2.fl.yelpcdn.com/photo/hxdJeepHlHLFyvJLWnQE2Q/o.jpg', 'name': 'Garrett Y.'}"
36bmPjOYLp6-Ql_IEiSQUw,KU7OER9pN4njvOSyz8Mkuw,https://www.yelp.com/biz/sacr%C3%A9-frenchy-paris-2?adjust_creative=Gfp9qSmSlgBP7eaVzQe-WQ&hrid=KU7OER9pN4njvOSyz8Mkuw&utm_campaign=yelp_api_v3&utm_medium=api_v3_business_reviews&utm_source=Gfp9qSmSlgBP7eaVzQe-WQ,"Popped in for French ""tapas"" - we just wanted to get some light bites with some wine after a lot of sightseeing. Grabbed the truffle fries, deviled eggs,...",5,2023-03-26 17:50:45,"{'id': 'osM4Ssqj-w-JTXGVe7TTuA', 'profile_url': 'https://www.yelp.com/user_details?userid=osM4Ssqj-w-JTXGVe7TTuA', 'image_url': 'https://s3-media2.fl.yelpcdn.com/photo/E7EMX0TMrzWLAdtF2dAWhA/o.jpg', 'name': 'Alicia C.'}"
36bmPjOYLp6-Ql_IEiSQUw,6ANdTCmAFIMXxwPQjDIhrA,https://www.yelp.com/biz/sacr%C3%A9-frenchy-paris-2?adjust_creative=Gfp9qSmSlgBP7eaVzQe-WQ&hrid=6ANdTCmAFIMXxwPQjDIhrA&utm_campaign=yelp_api_v3&utm_medium=api_v3_business_reviews&utm_source=Gfp9qSmSlgBP7eaVzQe-WQ,Great food and great ambiance. The piano player was a great addition to the atmosphere,5,2023-01-27 16:28:14,"{'id': 'MkuWNBmLa633nnG7u68NFA', 'profile_url': 'https://www.yelp.com/user_details?userid=MkuWNBmLa633nnG7u68NFA', 'image_url': None, 'name': 'Davin O.'}"
3K6B3W9N4wUD7l3GT7YUsg,bJNWq9qdikfH-l3t6P7xfA,https://www.yelp.com/biz/le-poulailler-paris?adjust_creative=Gfp9qSmSlgBP7eaVzQe-WQ&hrid=bJNWq9qdikfH-l3t6P7xfA&utm_campaign=yelp_api_v3&utm_medium=api_v3_business_reviews&utm_source=Gfp9qSmSlgBP7eaVzQe-WQ,"As a single female, this is a comfortable and friendly place to enjoy. I only had the appetizers (gyoza and cheese platter) both were delicious. The...",5,2019-01-24 07:42:23,"{'id': 'jDOe2vuI1vc0OZHOR3qi_A', 'profile_url': 'https://www.yelp.com/user_details?userid=jDOe2vuI1vc0OZHOR3qi_A', 'image_url': None, 'name': 'Danna H.'}"
3K6B3W9N4wUD7l3GT7YUsg,wZL9LD0smy8baY9BrnywkQ,https://www.yelp.com/biz/le-poulailler-paris?adjust_creative=Gfp9qSmSlgBP7eaVzQe-WQ&hrid=wZL9LD0smy8baY9BrnywkQ&utm_campaign=yelp_api_v3&utm_medium=api_v3_business_reviews&utm_source=Gfp9qSmSlgBP7eaVzQe-WQ,Great cozy wine bar between Republique and Bastille. Nice chill music played low volume. Nice staff. Good small crowd. Have beer too on tap and in bottle....,4,2013-11-28 13:31:36,"{'id': 'tkVPlyVNRVor8-Mn9DGYfw', 'profile_url': 'https://www.yelp.com/user_details?userid=tkVPlyVNRVor8-Mn9DGYfw', 'image_url': 'https://s3-media2.fl.yelpcdn.com/photo/NEfffmm8d3HM0_AUVrWvfA/o.jpg', 'name': 'Andres B.'}"
CZjokgK7fWD3IeGeQFg8lw,uPoyStEAnWmpana4RE9YHA,https://www.yelp.com/biz/caf%C3%A9-madame-paris?adjust_creative=Gfp9qSmSlgBP7eaVzQe-WQ&hrid=uPoyStEAnWmpana4RE9YHA&utm_campaign=yelp_api_v3&utm_medium=api_v3_business_reviews&utm_source=Gfp9qSmSlgBP7eaVzQe-WQ,Cute cafe in the 6th arrondissement - not far from the Jardin du Luxembourg.  Came here after checking into our hotel for a quick bite.  Food was delicious!...,4,2023-04-24 14:26:10,"{'id': '6TAa3ViO9EcAznbWza0aPw', 'profile_url': 'https://www.yelp.com/user_details?userid=6TAa3ViO9EcAznbWza0aPw', 'image_url': 'https://s3-media1.fl.yelpcdn.com/photo/ogOLXqggfKBQnuCZl-_8dA/o.jpg', 'name': 'Clare C.'}"
CZjokgK7fWD3IeGeQFg8lw,oRI_JaRZz45Hhs-UGyC8cg,https://www.yelp.com/biz/caf%C3%A9-madame-paris?adjust_creative=Gfp9qSmSlgBP7eaVzQe-WQ&hrid=oRI_JaRZz45Hhs-UGyC8cg&utm_campaign=yelp_api_v3&utm_medium=api_v3_business_reviews&utm_source=Gfp9qSmSlgBP7eaVzQe-WQ,"Amazing place! Very cozy but has enough space. Food was delicious, I tried Croque Madame.
Definitely recommended",5,2023-01-22 03:54:22,"{'id': 'E7gXkaRbyzWLCwtOWRpESA', 'profile_url': 'https://www.yelp.com/user_details?userid=E7gXkaRbyzWLCwtOWRpESA', 'image_url': 'https://s3-media2.fl.yelpcdn.com/photo/lNaMMbRRnCjzUH_2XUWRxw/o.jpg', 'name': 'Olia G.'}"
CZjokgK7fWD3IeGeQFg8lw,DPglyqwiKrtEflhAdSAcnA,https://www.yelp.com/biz/caf%C3%A9-madame-paris?adjust_creative=Gfp9qSmSlgBP7eaVzQe-WQ&hrid=DPglyqwiKrtEflhAdSAcnA&utm_campaign=yelp_api_v3&utm_medium=api_v3_business_reviews&utm_source=Gfp9qSmSlgBP7eaVzQe-WQ,"Small, delightful cafe! We were warmly welcomed. English was spoken and there was English translation on the menu. I had a vegetarian tartine and my husband...",5,2022-09-10 05:51:47,"{'id': 'WaA1bLaM_FJjtgFq6oasNQ', 'profile_url': 'https://www.yelp.com/user_details?userid=WaA1bLaM_FJjtgFq6oasNQ', 'image_url': 'https://s3-media2.fl.yelpcdn.com/photo/sjCU75nhFesUEzygmIiQug/o.jpg', 'name': 'Mindi G.'}"
Xh16xM655GFnFdGAXMGiFQ,XITjp9J7VqX9mIv5UytEmQ,https://www.yelp.com/biz/restaurant-de-la-tour-paris?adjust_creative=Gfp9qSmSlgBP7eaVzQe-WQ&hrid=XITjp9J7VqX9mIv5UytEmQ&utm_campaign=yelp_api_v3&utm_medium=api_v3_business_reviews&utm_source=Gfp9qSmSlgBP7eaVzQe-WQ,Food was great. The service was great. Plane on staying for 1.5 hours to eat your meal. It's all paced out perfect.,5,2023-04-11 12:10:25,"{'id': 'eqTG3F7Fh_zn7MGpC4kEug', 'profile_url': 'https://www.yelp.com/user_details?userid=eqTG3F7Fh_zn7MGpC4kEug', 'image_url': 'https://s3-media4.fl.yelpcdn.com/photo/qQZyfQzVLAy6BHw9_DZGDQ/o.jpg', 'name': 'Jim D.'}"
Xh16xM655GFnFdGAXMGiFQ,CFPrV9zyxnv_CMdyRHnF3Q,https://www.yelp.com/biz/restaurant-de-la-tour-paris?adjust_creative=Gfp9qSmSlgBP7eaVzQe-WQ&hrid=CFPrV9zyxnv_CMdyRHnF3Q&utm_campaign=yelp_api_v3&utm_medium=api_v3_business_reviews&utm_source=Gfp9qSmSlgBP7eaVzQe-WQ,My husband and I spent new years eve 2022-23 at the Restaurant de la Tour and loved the food. The menu was excellent. The only reason i gave it 4 stars and...,4,2023-01-07 08:15:03,"{'id': '_-0m7wAwoHEtmODH2P1ZNg', 'profile_url': 'https://www.yelp.com/user_details?userid=_-0m7wAwoHEtmODH2P1ZNg', 'image_url': 'https://s3-media3.fl.yelpcdn.com/photo/BHgOXRsGEZgnsDBZ-sPxtw/o.jpg', 'name': 'Rosa C.'}"
Xh16xM655GFnFdGAXMGiFQ,7xJ5bh--3k4eKi_eGxA_yQ,https://www.yelp.com/biz/restaurant-de-la-tour-paris?adjust_creative=Gfp9qSmSlgBP7eaVzQe-WQ&hrid=7xJ5bh--3k4eKi_eGxA_yQ&utm_campaign=yelp_api_v3&utm_medium=api_v3_business_reviews&utm_source=Gfp9qSmSlgBP7eaVzQe-WQ,"The best place we eat in Paris! The food and service was amazing the duck with berry sauce was delicious! The restaurant was small and intimate, will be...",5,2023-06-04 18:39:40,"{'id': 'AI-v4B2Z3TZmlNcCAVN5eQ', 'profile_url': 'https://www.yelp.com/user_details?userid=AI-v4B2Z3TZmlNcCAVN5eQ', 'image_url': None, 'name': 'Arilis O.'}"
5RrthvXitulQA4i7TRc1Rw,0DmTYkuqRZwckl_RjYlCCA,https://www.yelp.com/biz/les-bougresses-paris?adjust_creative=Gfp9qSmSlgBP7eaVzQe-WQ&hrid=0DmTYkuqRZwckl_RjYlCCA&utm_campaign=yelp_api_v3&utm_medium=api_v3_business_reviews&utm_source=Gfp9qSmSlgBP7eaVzQe-WQ,"Make sure you make a reservation!!! The food was amazing. Service was superb. Staff speaks fluent English. $28 set menus include 1 appetizer, 1 entree and 1...",5,2022-12-31 08:17:07,"{'id': '5VUCy_V_hV_3pnHplDCaUA', 'profile_url': 'https://www.yelp.com/user_details?userid=5VUCy_V_hV_3pnHplDCaUA', 'image_url': 'https://s3-media2.fl.yelpcdn.com/photo/7RL-TPlnmoMnxSk-aYW2wg/o.jpg', 'name': 'Steve C.'}"
5RrthvXitulQA4i7TRc1Rw,ySES2AQT_0hR5bxZX6sKLw,https://www.yelp.com/biz/les-bougresses-paris?adjust_creative=Gfp9qSmSlgBP7eaVzQe-WQ&hrid=ySES2AQT_0hR5bxZX6sKLw&utm_campaign=yelp_api_v3&utm_medium=api_v3_business_reviews&utm_source=Gfp9qSmSlgBP7eaVzQe-WQ,"Came here for dinner one evening. We made a reservation, which was a good idea, the place filled up quickly. For starters I got the salad with goat cheese...",4,2022-08-06 04:55:02,"{'id': 'q8V8MDINpPmPg_0STAsDSw', 'profile_url': 'https://www.yelp.com/user_details?userid=q8V8MDINpPmPg_0STAsDSw', 'image_url': 'https://s3-media4.fl.yelpcdn.com/photo/tnQlxi9jqo_qUKEYM9OULg/o.jpg', 'name': 'Daira R.'}"
5RrthvXitulQA4i7TRc1Rw,BRAS3vrlh82m3PssudxgmQ,https://www.yelp.com/biz/les-bougresses-paris?adjust_creative=Gfp9qSmSlgBP7eaVzQe-WQ&hrid=BRAS3vrlh82m3PssudxgmQ&utm_campaign=yelp_api_v3&utm_medium=api_v3_business_reviews&utm_source=Gfp9qSmSlgBP7eaVzQe-WQ,After a long day of site seeing and about 27k steps logged we wanted someplace close to our hotel for dinner and Les Bougresses fit the bill. Very nice...,4,2022-05-18 03:10:17,"{'id': 'kmSmVVb_XOpYnxSq7qns8w', 'profile_url': 'https://www.yelp.com/user_details?userid=kmSmVVb_XOpYnxSq7qns8w', 'image_url': 'https://s3-media2.fl.yelpcdn.com/photo/rQHdOHVyUrt4-SUG66D0-g/o.jpg', 'name': 'Jim A.'}"
egX8nlHUZceWCPDVdx9raw,YxYh3CWQ8n3DK1vG-t2tHQ,https://www.yelp.com/biz/arnaud-nicolas-paris?adjust_creative=Gfp9qSmSlgBP7eaVzQe-WQ&hrid=YxYh3CWQ8n3DK1vG-t2tHQ&utm_campaign=yelp_api_v3&utm_medium=api_v3_business_reviews&utm_source=Gfp9qSmSlgBP7eaVzQe-WQ,Vert friendly speaking and English understanding staff. Fantastic homemade dishes all prepared fresh daily. Famous for pies and sausages and foie gras.,5,2023-06-05 22:47:06,"{'id': 'lUQ86yv_PAqNhOSebDb7PA', 'profile_url': 'https://www.yelp.com/user_details?userid=lUQ86yv_PAqNhOSebDb7PA', 'image_url': 'https://s3-media1.fl.yelpcdn.com/photo/V22W5F-OFfcj0P1DuGxa9w/o.jpg', 'name': 'Sebastian C.'}"
egX8nlHUZceWCPDVdx9raw,I5OZP-HtIt5VSZFZjTBiXw,https://www.yelp.com/biz/arnaud-nicolas-paris?adjust_creative=Gfp9qSmSlgBP7eaVzQe-WQ&hrid=I5OZP-HtIt5VSZFZjTBiXw&utm_campaign=yelp_api_v3&utm_medium=api_v3_business_reviews&utm_source=Gfp9qSmSlgBP7eaVzQe-WQ,"Out of the 3 restaurants we went to in Paris, this was the best! Atmosphere was relaxing. It's a 5 min walk to the Eiffel Tower, and the food is superb. I'm...",5,2022-12-08 06:03:51,"{'id': 'fXIHqrWqTUmLYiFd7UsUAw', 'profile_url': 'https://www.yelp.com/user_details?userid=fXIHqrWqTUmLYiFd7UsUAw', 'image_url': 'https://s3-media2.fl.yelpcdn.com/photo/oSXaNVEP3UXrTiITxz7_pg/o.jpg', 'name': 'Bob C.'}"
egX8nlHUZceWCPDVdx9raw,JVWu6v5vr5Qn9j2LWZPg2A,https://www.yelp.com/biz/arnaud-nicolas-paris?adjust_creative=Gfp9qSmSlgBP7eaVzQe-WQ&hrid=JVWu6v5vr5Qn9j2LWZPg2A&utm_campaign=yelp_api_v3&utm_medium=api_v3_business_reviews&utm_source=Gfp9qSmSlgBP7eaVzQe-WQ,"With the best terrines and paté in Paris, we took an arduous metro from the 11th Arrondissement to the 7th to purchase culinary artistry from Arnaud...",5,2022-05-23 03:13:30,"{'id': 'OEEecY20Wtb7KEKUlx6bNA', 'profile_url': 'https://www.yelp.com/user_details?userid=OEEecY20Wtb7KEKUlx6bNA', 'image_url': 'https://s3-media2.fl.yelpcdn.com/photo/bVmGWA6EB93fMSoaH0jlag/o.jpg', 'name': 'Phil G.'}"
I9rvKHLA1-EPZw_wswesEA,4OcyoUtCz8LYpx0ZLQp5kA,https://www.yelp.com/biz/le-cirque-paris?adjust_creative=Gfp9qSmSlgBP7eaVzQe-WQ&hrid=4OcyoUtCz8LYpx0ZLQp5kA&utm_campaign=yelp_api_v3&utm_medium=api_v3_business_reviews&utm_source=Gfp9qSmSlgBP7eaVzQe-WQ,What a cute find! Its was a play on American food in a very odd circus surrounding in the Le Marais neighborhood. Tasty pizzas salads soup and a to die for...,4,2022-03-06 03:26:47,"{'id': '-SzrgJ7YDjZkgat_pjAw9Q', 'profile_url': 'https://www.yelp.com/user_details?userid=-SzrgJ7YDjZkgat_pjAw9Q', 'image_url': 'https://s3-media3.fl.yelpcdn.com/photo/tllkzrzQiDwrMHd656lDQA/o.jpg', 'name': 'Ivette V.'}"
I9rvKHLA1-EPZw_wswesEA,nqaK6jdcuqFb1qCRVMBA6w,https://www.yelp.com/biz/le-cirque-paris?adjust_creative=Gfp9qSmSlgBP7eaVzQe-WQ&hrid=nqaK6jdcuqFb1qCRVMBA6w&utm_campaign=yelp_api_v3&utm_medium=api_v3_business_reviews&utm_source=Gfp9qSmSlgBP7eaVzQe-WQ,"My then Boyfriend had me sit here, while he went and picked up my surprise. In the beginning service was fine.  I order 2 got chocolate while visiting....",2,2017-12-22 02:32:22,"{'id': 'u5xRYdVlNHx0AsUt8JFBtQ', 'profile_url': 'https://www.yelp.com/user_details?userid=u5xRYdVlNHx0AsUt8JFBtQ', 'image_url': 'https://s3-media3.fl.yelpcdn.com/photo/4_CuQfptTWnAxasvENITQw/o.jpg', 'name': 'Brittany H.'}"
I9rvKHLA1-EPZw_wswesEA,7GFA0dEPLBSboOms1wtMyA,https://www.yelp.com/biz/le-cirque-paris?adjust_creative=Gfp9qSmSlgBP7eaVzQe-WQ&hrid=7GFA0dEPLBSboOms1wtMyA&utm_campaign=yelp_api_v3&utm_medium=api_v3_business_reviews&utm_source=Gfp9qSmSlgBP7eaVzQe-WQ,"Excellent wine and service - grabbed a couple of glasses to relax on the patio, on a busy Sunday afternoon and our table was lovely with a beautiful view of...",5,2017-07-10 06:25:36,"{'id': '37HswRimgBEf7_US-c3CDA', 'profile_url': 'https://www.yelp.com/user_details?userid=37HswRimgBEf7_US-c3CDA', 'image_url': 'https://s3-media4.fl.yelpcdn.com/photo/kolUBlJJP9oEkwzr5QwgQA/o.jpg', 'name': 'Adrienne G.'}"
-JX9WdcLezp4g6Ts8SG8qg,IEZhWhqB7PPtys--u8MXwQ,https://www.yelp.com/biz/20-eiffel-paris?adjust_creative=Gfp9qSmSlgBP7eaVzQe-WQ&hrid=IEZhWhqB7PPtys--u8MXwQ&utm_campaign=yelp_api_v3&utm_medium=api_v3_business_reviews&utm_source=Gfp9qSmSlgBP7eaVzQe-WQ,Stumbled upon this lovely restaurant on the way to just get a closer glimpse of the Eiffel Tower.  The restaurant as you can see from the pic is on one of...,5,2022-07-24 08:02:13,"{'id': '7BUA08h_Hsm6FHZxUH3_dA', 'profile_url': 'https://www.yelp.com/user_details?userid=7BUA08h_Hsm6FHZxUH3_dA', 'image_url': 'https://s3-media2.fl.yelpcdn.com/photo/nJKIAYP05zaIoR8rJiIFOg/o.jpg', 'name': 'Rick R.'}"
-JX9WdcLezp4g6Ts8SG8qg,PbbUWiWv5dg_i4ZqNJM72A,https://www.yelp.com/biz/20-eiffel-paris?adjust_creative=Gfp9qSmSlgBP7eaVzQe-WQ&hrid=PbbUWiWv5dg_i4ZqNJM72A&utm_campaign=yelp_api_v3&utm_medium=api_v3_business_reviews&utm_source=Gfp9qSmSlgBP7eaVzQe-WQ,Found this restaurant on a whim after a cold morning touring/climbing the Eiffel Tower. I walked by and saw they received  Michelin Star in 2017 so I had to...,5,2018-11-30 08:21:13,"{'id': 'ADD7s6z0sTO1Dxr2EMSwGg', 'profile_url': 'https://www.yelp.com/user_details?userid=ADD7s6z0sTO1Dxr2EMSwGg', 'image_url': 'https://s3-media1.fl.yelpcdn.com/photo/8151qG-orHfFe-bsm22peA/o.jpg', 'name': 'Irene C.'}"
-JX9WdcLezp4g6Ts8SG8qg,wbkoj8HB2Hf-aJ8SoErFyQ,https://www.yelp.com/biz/20-eiffel-paris?adjust_creative=Gfp9qSmSlgBP7eaVzQe-WQ&hrid=wbkoj8HB2Hf-aJ8SoErFyQ&utm_campaign=yelp_api_v3&utm_medium=api_v3_business_reviews&utm_source=Gfp9qSmSlgBP7eaVzQe-WQ,"Not a bad spot to grab lunch. Prices are a bit high, but the food quality is awesome. Food portions are about half that of an American restaurant, so don't...",4,2019-04-19 09:49:43,"{'id': 'f5Ny_xk2AWwdwufdX8r1Tg', 'profile_url': 'https://www.yelp.com/user_details?userid=f5Ny_xk2AWwdwufdX8r1Tg', 'image_url': 'https://s3-media1.fl.yelpcdn.com/photo/prWvTSsl7NhdkCj0a7OZwg/o.jpg', 'name': 'Ronnie C.'}"
