restaurant_id,id,url,text,rating,time_created,user
ePu3Me3SA4lVM-wGzKk0xA,wejeLM6zS_qWL6U4rU0okg,https://www.yelp.com/biz/le-bistro-lyonnais-paris?adjust_creative=Gfp9qSmSlgBP7eaVzQe-WQ&hrid=wejeLM6zS_qWL6U4rU0okg&utm_campaign=yelp_api_v3&utm_medium=api_v3_business_reviews&utm_source=Gfp9qSmSlgBP7eaVzQe-WQ,Service was super nice and friendly. We are here for dinner one night and really wanted to like the place but Food was not good. Prices were high for what...,1,2021-11-23 23:52:17,"{'id': '8ZryN_S-n48g6rsa3W3QtQ', 'profile_url': 'https://www.yelp.com/user_details?userid=8ZryN_S-n48g6rsa3W3QtQ', 'image_url': 'https://s3-media1.fl.yelpcdn.com/photo/MW2vv81A-29NlN1wAlmSSQ/o.jpg', 'name': 'Dani S.'}"
ePu3Me3SA4lVM-wGzKk0xA,Iyk4pVtnVF92OU0zB61GmA,https://www.yelp.com/biz/le-bistro-lyonnais-paris?adjust_creative=Gfp9qSmSlgBP7eaVzQe-WQ&hrid=Iyk4pVtnVF92OU0zB61GmA&utm_campaign=yelp_api_v3&utm_medium=api_v3_business_reviews&utm_source=Gfp9qSmSlgBP7eaVzQe-WQ,"Drinks, entrees and service were excellent. As with most brassiere's nearby, this was a tad smaller but came out more than I expected. Our waiter, Loren,...",5,2022-10-16 10:08:49,"{'id': 'ROTDP3WHN9TEcLxbDf0YAA', 'profile_url': 'https://www.yelp.com/user_details?userid=ROTDP3WHN9TEcLxbDf0YAA', 'image_url': 'https://s3-media3.fl.yelpcdn.com/photo/EIGORrry94R_Tg32t6pSCQ/o.jpg', 'name': 'vicky f.'}"
K-cAB9sz9UoopOP0APEi0g,k3PsuP3_VSJt9SOCzmEk9w,https://www.yelp.com/biz/les-cocottes-paris-4?adjust_creative=Gfp9qSmSlgBP7eaVzQe-WQ&hrid=k3PsuP3_VSJt9SOCzmEk9w&utm_campaign=yelp_api_v3&utm_medium=api_v3_business_reviews&utm_source=Gfp9qSmSlgBP7eaVzQe-WQ,"One of our best meals in Paris!  Wonderful, welcoming staff with excellent service. You can tell they really pride themselves on their quality of food and...",5,2023-03-10 13:25:11,"{'id': 'YvqFcX5s0cHhqAFrXvNOHw', 'profile_url': 'https://www.yelp.com/user_details?userid=YvqFcX5s0cHhqAFrXvNOHw', 'image_url': 'https://s3-media3.fl.yelpcdn.com/photo/FieEgr_rDTc8IsoLzHlnJQ/o.jpg', 'name': 'Michele G.'}"
K-cAB9sz9UoopOP0APEi0g,4VoKxSzrsmbXjkbGgMA_pQ,https://www.yelp.com/biz/les-cocottes-paris-4?adjust_creative=Gfp9qSmSlgBP7eaVzQe-WQ&hrid=4VoKxSzrsmbXjkbGgMA_pQ&utm_campaign=yelp_api_v3&utm_medium=api_v3_business_reviews&utm_source=Gfp9qSmSlgBP7eaVzQe-WQ,"RUDE! RUDE! RUDE!!!!!!

Must to avoid unless you enjoy stuck up, rude staff and overpriced food at what amounts to a diner atmosphere.

So many great places...",1,2023-05-13 08:05:41,"{'id': 'AYEuYdpTsAjZwsZfbwIs3A', 'profile_url': 'https://www.yelp.com/user_details?userid=AYEuYdpTsAjZwsZfbwIs3A', 'image_url': 'https://s3-media3.fl.yelpcdn.com/photo/m8csJxb4amOutWN2SROGSA/o.jpg', 'name': 'Bill M.'}"
K-cAB9sz9UoopOP0APEi0g,H_EaVoUuGqldZ2KJVKbPkg,https://www.yelp.com/biz/les-cocottes-paris-4?adjust_creative=Gfp9qSmSlgBP7eaVzQe-WQ&hrid=H_EaVoUuGqldZ2KJVKbPkg&utm_campaign=yelp_api_v3&utm_medium=api_v3_business_reviews&utm_source=Gfp9qSmSlgBP7eaVzQe-WQ,All I gotta say is I loved my pigeon platter .  It was cooked medium rare and it came out delicious.  Tender and reminded me of a cross between beef and...,4,2023-03-15 16:47:25,"{'id': 'MtoMNT9EA-jHAK93YyhHbA', 'profile_url': 'https://www.yelp.com/user_details?userid=MtoMNT9EA-jHAK93YyhHbA', 'image_url': 'https://s3-media2.fl.yelpcdn.com/photo/X5x0u3sZ1PE0fQh9xlYEfA/o.jpg', 'name': 'Dan M.'}"
ZE1PAvs-7pOaIuVcKGZvvw,71GtiRd1IbA5DPooi9nAYw,https://www.yelp.com/biz/caf%C3%A9-louise-paris?adjust_creative=Gfp9qSmSlgBP7eaVzQe-WQ&hrid=71GtiRd1IbA5DPooi9nAYw&utm_campaign=yelp_api_v3&utm_medium=api_v3_business_reviews&utm_source=Gfp9qSmSlgBP7eaVzQe-WQ,"We were looking for a good late-night bite after a concert in Paris, and I found Cafe Louise on some list. It was a good choice. It's a quintessential...",5,2023-03-10 05:32:20,"{'id': 'W7Kz2IfXL6aVsFXnFWSwrg', 'profile_url': 'https://www.yelp.com/user_details?userid=W7Kz2IfXL6aVsFXnFWSwrg', 'image_url': 'https://s3-media1.fl.yelpcdn.com/photo/4nDw9LYmcWdkEPpTFN336A/o.jpg', 'name': 'Sue S.'}"
ZE1PAvs-7pOaIuVcKGZvvw,VxYxfL4jquh7qZtraG5Pfw,https://www.yelp.com/biz/caf%C3%A9-louise-paris?adjust_creative=Gfp9qSmSlgBP7eaVzQe-WQ&hrid=VxYxfL4jquh7qZtraG5Pfw&utm_campaign=yelp_api_v3&utm_medium=api_v3_business_reviews&utm_source=Gfp9qSmSlgBP7eaVzQe-WQ,"Went to Cafe Louise as this was having a nice menu offering for New Years Eve with live music and DJ party. However, this was not the case at all. 

We were...",2,2023-01-05 00:14:52,"{'id': 'kaXvWJRw63nW3dqCt1IMNA', 'profile_url': 'https://www.yelp.com/user_details?userid=kaXvWJRw63nW3dqCt1IMNA', 'image_url': 'https://s3-media3.fl.yelpcdn.com/photo/W_qwQFdBYCosQp8qKcb-Iw/o.jpg', 'name': 'Amanda W.'}"
ZE1PAvs-7pOaIuVcKGZvvw,g2HkJxURQRENVQShPApirg,https://www.yelp.com/biz/caf%C3%A9-louise-paris?adjust_creative=Gfp9qSmSlgBP7eaVzQe-WQ&hrid=g2HkJxURQRENVQShPApirg&utm_campaign=yelp_api_v3&utm_medium=api_v3_business_reviews&utm_source=Gfp9qSmSlgBP7eaVzQe-WQ,"We had the Go City Paris pass, and this was one of the restaurants that offered a free breakfast through the pass. I was a little weary about what to...",5,2023-03-24 00:56:12,"{'id': 'gKKfktjb4w7oujcHM6_7aQ', 'profile_url': 'https://www.yelp.com/user_details?userid=gKKfktjb4w7oujcHM6_7aQ', 'image_url': 'https://s3-media3.fl.yelpcdn.com/photo/8Ia7TDVzj81DISkyd1NcXA/o.jpg', 'name': 'Tonya G.'}"
pjkb5ix5JEN9jMQYf8AgIQ,poo0CXwcAUn-nV5D55Jr1Q,https://www.yelp.com/biz/la-consigne-paris-2?adjust_creative=Gfp9qSmSlgBP7eaVzQe-WQ&hrid=poo0CXwcAUn-nV5D55Jr1Q&utm_campaign=yelp_api_v3&utm_medium=api_v3_business_reviews&utm_source=Gfp9qSmSlgBP7eaVzQe-WQ,Good food. Good service and clean facilities. We really enjoyed our breakfast!  Near Gara Se Lyon,5,2023-02-22 22:28:15,"{'id': 'V15VQqKaFvl96fpmplpVwQ', 'profile_url': 'https://www.yelp.com/user_details?userid=V15VQqKaFvl96fpmplpVwQ', 'image_url': 'https://s3-media1.fl.yelpcdn.com/photo/2_eNZ-SDP33AIl1KevyLqQ/o.jpg', 'name': 'Foodie W.'}"
pjkb5ix5JEN9jMQYf8AgIQ,n7xfB9pykZwmQYuSHdOozQ,https://www.yelp.com/biz/la-consigne-paris-2?adjust_creative=Gfp9qSmSlgBP7eaVzQe-WQ&hrid=n7xfB9pykZwmQYuSHdOozQ&utm_campaign=yelp_api_v3&utm_medium=api_v3_business_reviews&utm_source=Gfp9qSmSlgBP7eaVzQe-WQ,"Delightful experience; this brasserie is quite charming and cozy. On this rainy day, I enjoyed sitting indoors but appreciated all of the opened windows...",4,2015-08-20 16:43:30,"{'id': 'Ygcv3NX9_oEAwLli_GdKrQ', 'profile_url': 'https://www.yelp.com/user_details?userid=Ygcv3NX9_oEAwLli_GdKrQ', 'image_url': 'https://s3-media1.fl.yelpcdn.com/photo/PYsCBisSlWgdKOqexidocw/o.jpg', 'name': 'Laura L.'}"
pjkb5ix5JEN9jMQYf8AgIQ,DERgyZ3UjlagHkf_fnhKJQ,https://www.yelp.com/biz/la-consigne-paris-2?adjust_creative=Gfp9qSmSlgBP7eaVzQe-WQ&hrid=DERgyZ3UjlagHkf_fnhKJQ&utm_campaign=yelp_api_v3&utm_medium=api_v3_business_reviews&utm_source=Gfp9qSmSlgBP7eaVzQe-WQ,"Being tourists in France, it was quite intimidating to find a place to eat, but this place had a very welcoming feel to it (plus, English translation on the...",5,2018-05-24 23:41:22,"{'id': 'tmy8IKfQFIF_zWeUIBuBwA', 'profile_url': 'https://www.yelp.com/user_details?userid=tmy8IKfQFIF_zWeUIBuBwA', 'image_url': 'https://s3-media3.fl.yelpcdn.com/photo/tmt2xVr94OBbSTAhq7bJVA/o.jpg', 'name': 'Katrina V.'}"
wzWEeTyVtUgRfsz_eSSVKw,l8-vU435kTMeqDs1HITQZA,https://www.yelp.com/biz/le-saint-andr%C3%A9-paris-2?adjust_creative=Gfp9qSmSlgBP7eaVzQe-WQ&hrid=l8-vU435kTMeqDs1HITQZA&utm_campaign=yelp_api_v3&utm_medium=api_v3_business_reviews&utm_source=Gfp9qSmSlgBP7eaVzQe-WQ,"Was recommended by a friend, and they did not disappoint. Their Margherita Pizza was crispy, and cooked to perfection. The waiter brought out chili oil...",5,2023-04-02 06:29:41,"{'id': 'OfuoDOS3OHD7tMFcLN-xcA', 'profile_url': 'https://www.yelp.com/user_details?userid=OfuoDOS3OHD7tMFcLN-xcA', 'image_url': 'https://s3-media2.fl.yelpcdn.com/photo/XPpinxwxOgGFfeTyNCVmHg/o.jpg', 'name': 'Madden F.'}"
wzWEeTyVtUgRfsz_eSSVKw,QAKmbQywoOO8oyiIRzLtKw,https://www.yelp.com/biz/le-saint-andr%C3%A9-paris-2?adjust_creative=Gfp9qSmSlgBP7eaVzQe-WQ&hrid=QAKmbQywoOO8oyiIRzLtKw&utm_campaign=yelp_api_v3&utm_medium=api_v3_business_reviews&utm_source=Gfp9qSmSlgBP7eaVzQe-WQ,"The outside is very comfortable and welcoming, it's placed on the corner and your drawn in by their front signage. 
The food was delicious, the spaghetti...",5,2022-06-01 06:58:26,"{'id': 'YAbW53wuLpeXVlyoEt8H6g', 'profile_url': 'https://www.yelp.com/user_details?userid=YAbW53wuLpeXVlyoEt8H6g', 'image_url': 'https://s3-media1.fl.yelpcdn.com/photo/ycn-TLaZz8-_DcMUhgOKag/o.jpg', 'name': 'Katie L.'}"
wzWEeTyVtUgRfsz_eSSVKw,uPtqBywPgphJrjqUGMwdFg,https://www.yelp.com/biz/le-saint-andr%C3%A9-paris-2?adjust_creative=Gfp9qSmSlgBP7eaVzQe-WQ&hrid=uPtqBywPgphJrjqUGMwdFg&utm_campaign=yelp_api_v3&utm_medium=api_v3_business_reviews&utm_source=Gfp9qSmSlgBP7eaVzQe-WQ,Popped off the metro and looking for a place to grab a bite and a glass of wine. As soon as I looked down the street and saw this place I knew it was the...,5,2018-07-22 07:57:00,"{'id': '4Yj3uQBzdP8SFxxAkOnxgw', 'profile_url': 'https://www.yelp.com/user_details?userid=4Yj3uQBzdP8SFxxAkOnxgw', 'image_url': 'https://s3-media2.fl.yelpcdn.com/photo/ZuxmzWnNzSNHEdi3uaxduA/o.jpg', 'name': 'Sarah K.'}"
5jviAXLXm5E78wlpE0pTxA,0yjiPmDclspc4HVmkbB9Bg,https://www.yelp.com/biz/iovines-paris-2?adjust_creative=Gfp9qSmSlgBP7eaVzQe-WQ&hrid=0yjiPmDclspc4HVmkbB9Bg&utm_campaign=yelp_api_v3&utm_medium=api_v3_business_reviews&utm_source=Gfp9qSmSlgBP7eaVzQe-WQ,"Almost the best pizza ever....! Excellent dough, fluffy and chewy. Such a great find! We got three different types of pizza and they were all excellent....",5,2022-09-18 14:16:33,"{'id': 'fK5sVrz96GgknyZaZFApYA', 'profile_url': 'https://www.yelp.com/user_details?userid=fK5sVrz96GgknyZaZFApYA', 'image_url': 'https://s3-media3.fl.yelpcdn.com/photo/NATCct7P67OGkDCG0XbyGg/o.jpg', 'name': 'Lisa G.'}"
5jviAXLXm5E78wlpE0pTxA,fZV2wtfkLA6QxNCAMD0Guw,https://www.yelp.com/biz/iovines-paris-2?adjust_creative=Gfp9qSmSlgBP7eaVzQe-WQ&hrid=fZV2wtfkLA6QxNCAMD0Guw&utm_campaign=yelp_api_v3&utm_medium=api_v3_business_reviews&utm_source=Gfp9qSmSlgBP7eaVzQe-WQ,"Best pizza and tiramisu I have ever tried(exceeded even Italy), must visit place in Paris!!",5,2022-06-26 10:36:22,"{'id': 'KNda9T66cM2I5mk3bdK6VQ', 'profile_url': 'https://www.yelp.com/user_details?userid=KNda9T66cM2I5mk3bdK6VQ', 'image_url': None, 'name': 'Inga R.'}"
5jviAXLXm5E78wlpE0pTxA,1eCCh5dq6Xpq3p2dvGhw8Q,https://www.yelp.com/biz/iovines-paris-2?adjust_creative=Gfp9qSmSlgBP7eaVzQe-WQ&hrid=1eCCh5dq6Xpq3p2dvGhw8Q&utm_campaign=yelp_api_v3&utm_medium=api_v3_business_reviews&utm_source=Gfp9qSmSlgBP7eaVzQe-WQ,"Ok first off maybe unfair, but I know the difference between American Pizza and Neapolitan. I've been cooking wood fired Brick oven pizza for 13 years and...",1,2022-06-14 14:53:15,"{'id': 'Kb6lrdBkWlAYh4KGcuNQgQ', 'profile_url': 'https://www.yelp.com/user_details?userid=Kb6lrdBkWlAYh4KGcuNQgQ', 'image_url': 'https://s3-media3.fl.yelpcdn.com/photo/ogykf3Ij9tlZBnvnwmcMMQ/o.jpg', 'name': 'John S.'}"
prSiklkzkMYOPs7IoONtjA,nGQQof0Wr70bfytfKZ0UlA,https://www.yelp.com/biz/dong-phat-paris?adjust_creative=Gfp9qSmSlgBP7eaVzQe-WQ&hrid=nGQQof0Wr70bfytfKZ0UlA&utm_campaign=yelp_api_v3&utm_medium=api_v3_business_reviews&utm_source=Gfp9qSmSlgBP7eaVzQe-WQ,"If you're in the mood for some delicious Vietnamese cuisine, look no further than Dong Phat. I recently visited this cozy little restaurant and was blown...",5,2023-05-04 14:47:08,"{'id': 'Xa2UsorMvCSTp4Fkpspnkw', 'profile_url': 'https://www.yelp.com/user_details?userid=Xa2UsorMvCSTp4Fkpspnkw', 'image_url': 'https://s3-media3.fl.yelpcdn.com/photo/bFf4xq6RwQKZu4sw9OqWiA/o.jpg', 'name': 'Lynne T.'}"
prSiklkzkMYOPs7IoONtjA,IuFYLyXGnhTYAR2YGIeAbA,https://www.yelp.com/biz/dong-phat-paris?adjust_creative=Gfp9qSmSlgBP7eaVzQe-WQ&hrid=IuFYLyXGnhTYAR2YGIeAbA&utm_campaign=yelp_api_v3&utm_medium=api_v3_business_reviews&utm_source=Gfp9qSmSlgBP7eaVzQe-WQ,"Was really craving bun and this was the closest Viet restaurant with good reviews. It was more mixed dishes, I think. We got the vermicelli and mapo...",3,2023-03-20 11:15:40,"{'id': 'LNKfpSlUvXm0mWAXYM2spw', 'profile_url': 'https://www.yelp.com/user_details?userid=LNKfpSlUvXm0mWAXYM2spw', 'image_url': 'https://s3-media4.fl.yelpcdn.com/photo/Cpi8Vf7j5S_YlRqRtgCp5A/o.jpg', 'name': 'Claudine L.'}"
prSiklkzkMYOPs7IoONtjA,i0WKDFNtfq8HZwrzR1CU8Q,https://www.yelp.com/biz/dong-phat-paris?adjust_creative=Gfp9qSmSlgBP7eaVzQe-WQ&hrid=i0WKDFNtfq8HZwrzR1CU8Q&utm_campaign=yelp_api_v3&utm_medium=api_v3_business_reviews&utm_source=Gfp9qSmSlgBP7eaVzQe-WQ,"When my family visited Paris, we stopped by this restaurant twice (on the same day). It was 15 minutes walk from the Eiffel tower. I would say this was...",5,2023-01-06 07:08:21,"{'id': 'mJzjiHw_3ELd4eoBOq7h1g', 'profile_url': 'https://www.yelp.com/user_details?userid=mJzjiHw_3ELd4eoBOq7h1g', 'image_url': 'https://s3-media2.fl.yelpcdn.com/photo/hXxRyMc5BprUACLIvkVpvg/o.jpg', 'name': 'Lan T.'}"
5H-68D5LFLvoOSUJ1zsuPQ,iCRPCBWj2LM8WOUI0LseqQ,https://www.yelp.com/biz/la-seine-caf%C3%A9-paris-4?adjust_creative=Gfp9qSmSlgBP7eaVzQe-WQ&hrid=iCRPCBWj2LM8WOUI0LseqQ&utm_campaign=yelp_api_v3&utm_medium=api_v3_business_reviews&utm_source=Gfp9qSmSlgBP7eaVzQe-WQ,Came highly recommended. You will need to show your QR code or proof of vaccination. The menu is in French. Nice atmosphere and cozy.,5,2021-11-04 13:50:56,"{'id': 'vKKSx4wSUjzfnBzWzz8m3Q', 'profile_url': 'https://www.yelp.com/user_details?userid=vKKSx4wSUjzfnBzWzz8m3Q', 'image_url': None, 'name': 'Torbin G.'}"
5H-68D5LFLvoOSUJ1zsuPQ,wB2-WC761CkErvmcOC1I0g,https://www.yelp.com/biz/la-seine-caf%C3%A9-paris-4?adjust_creative=Gfp9qSmSlgBP7eaVzQe-WQ&hrid=wB2-WC761CkErvmcOC1I0g&utm_campaign=yelp_api_v3&utm_medium=api_v3_business_reviews&utm_source=Gfp9qSmSlgBP7eaVzQe-WQ,"This was our favorite brasserie near La Bastille.  Located across from the canal and a beautiful park, the service, drinks, and food were excellent.  Very...",5,2017-07-16 05:45:23,"{'id': 'dgy_MWJ81wYnjoeNAJZgwA', 'profile_url': 'https://www.yelp.com/user_details?userid=dgy_MWJ81wYnjoeNAJZgwA', 'image_url': 'https://s3-media4.fl.yelpcdn.com/photo/6xXSo80YKzWz0gxMHh_E6Q/o.jpg', 'name': 'M K.'}"
5TbITr_zImkiSc_EWOJkjw,M7yR6Jwi4t97IIezSYf11Q,https://www.yelp.com/biz/girafe-paris?adjust_creative=Gfp9qSmSlgBP7eaVzQe-WQ&hrid=M7yR6Jwi4t97IIezSYf11Q&utm_campaign=yelp_api_v3&utm_medium=api_v3_business_reviews&utm_source=Gfp9qSmSlgBP7eaVzQe-WQ,I had my last meal in Paris at Suite Girafe. It was perhaps the best meal i've ever had. Zoe was phenomenal waitress and steered me in the right direction...,5,2023-04-18 18:34:25,"{'id': 'UJaI94I_fxd4--ngts3gDA', 'profile_url': 'https://www.yelp.com/user_details?userid=UJaI94I_fxd4--ngts3gDA', 'image_url': 'https://s3-media3.fl.yelpcdn.com/photo/to00vUePUETcmHelM8C8AQ/o.jpg', 'name': 'Meredith A.'}"
5TbITr_zImkiSc_EWOJkjw,POkb89FSCAR1x3cl-RC7Dw,https://www.yelp.com/biz/girafe-paris?adjust_creative=Gfp9qSmSlgBP7eaVzQe-WQ&hrid=POkb89FSCAR1x3cl-RC7Dw&utm_campaign=yelp_api_v3&utm_medium=api_v3_business_reviews&utm_source=Gfp9qSmSlgBP7eaVzQe-WQ,"This place is overhyped. I've had better food and service at other restaurants nearby.

Make a reservation, but understand that this place requires you to...",1,2023-06-04 11:00:52,"{'id': '3hm6Y37TWacSIJrbOGOBCg', 'profile_url': 'https://www.yelp.com/user_details?userid=3hm6Y37TWacSIJrbOGOBCg', 'image_url': 'https://s3-media4.fl.yelpcdn.com/photo/EipauCWCo9I-Lc5_n8AWsw/o.jpg', 'name': 'Andre G.'}"
5TbITr_zImkiSc_EWOJkjw,smK0V9EhCVHtdAMbVSFZjg,https://www.yelp.com/biz/girafe-paris?adjust_creative=Gfp9qSmSlgBP7eaVzQe-WQ&hrid=smK0V9EhCVHtdAMbVSFZjg&utm_campaign=yelp_api_v3&utm_medium=api_v3_business_reviews&utm_source=Gfp9qSmSlgBP7eaVzQe-WQ,"HANDS DOWN THE BEST LOBSTER LINGUINE  AND GRILLED OCTOPUS!

Girafe is a must visit if you're in Paris! They're at the most perfect location in Trocadéro so...",5,2022-12-08 22:30:10,"{'id': 'aHUiRPr4rhIEh-v1_HhORQ', 'profile_url': 'https://www.yelp.com/user_details?userid=aHUiRPr4rhIEh-v1_HhORQ', 'image_url': 'https://s3-media1.fl.yelpcdn.com/photo/5J36CIIqaDH7us3DxaX_Mg/o.jpg', 'name': 'Jonathan W.'}"
UdyUNz28MNot1SfTQjdE7A,dk1-DEM_SKUPKt8PeIluDQ,https://www.yelp.com/biz/les-petites-bouch%C3%A9es-paris?adjust_creative=Gfp9qSmSlgBP7eaVzQe-WQ&hrid=dk1-DEM_SKUPKt8PeIluDQ&utm_campaign=yelp_api_v3&utm_medium=api_v3_business_reviews&utm_source=Gfp9qSmSlgBP7eaVzQe-WQ,"Great place for tapas, good wine & friendly staff that will help with translations! Great experience & tremendous food.",5,2023-04-25 03:23:56,"{'id': 'QU-75VXHp0sifQckDMRPvQ', 'profile_url': 'https://www.yelp.com/user_details?userid=QU-75VXHp0sifQckDMRPvQ', 'image_url': None, 'name': 'Frank D.'}"
UdyUNz28MNot1SfTQjdE7A,GGaYCH17JWJewHTWM7OMGg,https://www.yelp.com/biz/les-petites-bouch%C3%A9es-paris?adjust_creative=Gfp9qSmSlgBP7eaVzQe-WQ&hrid=GGaYCH17JWJewHTWM7OMGg&utm_campaign=yelp_api_v3&utm_medium=api_v3_business_reviews&utm_source=Gfp9qSmSlgBP7eaVzQe-WQ,My wife and I took a holiday trip to Paris recently and Les Petites Bouchees was by far one of out favorite restaurants of the entire week! It is a cozy...,5,2021-12-08 09:58:27,"{'id': 'qb4l3B1VifNbkGkC61emSA', 'profile_url': 'https://www.yelp.com/user_details?userid=qb4l3B1VifNbkGkC61emSA', 'image_url': 'https://s3-media3.fl.yelpcdn.com/photo/L93tVz-doEg6gXWaa_pM3w/o.jpg', 'name': 'Winston G.'}"
UdyUNz28MNot1SfTQjdE7A,mOfbNeAQA0HMDPXRrGr-Jg,https://www.yelp.com/biz/les-petites-bouch%C3%A9es-paris?adjust_creative=Gfp9qSmSlgBP7eaVzQe-WQ&hrid=mOfbNeAQA0HMDPXRrGr-Jg&utm_campaign=yelp_api_v3&utm_medium=api_v3_business_reviews&utm_source=Gfp9qSmSlgBP7eaVzQe-WQ,"Great food and great service!
We ate here twice on our trip and both times we had an excellent experience. Our favorite was the vegetable tart.",5,2022-08-13 06:35:46,"{'id': 'Vz0UqX-Rq0HVQT1q2D-3Fw', 'profile_url': 'https://www.yelp.com/user_details?userid=Vz0UqX-Rq0HVQT1q2D-3Fw', 'image_url': None, 'name': 'A. K.'}"
ZxtU74SJMRoB8ZQXWwNtRQ,-vLK6JEFn6eHcz0YtFXVHA,https://www.yelp.com/biz/le-souffl%C3%A9-paris-2?adjust_creative=Gfp9qSmSlgBP7eaVzQe-WQ&hrid=-vLK6JEFn6eHcz0YtFXVHA&utm_campaign=yelp_api_v3&utm_medium=api_v3_business_reviews&utm_source=Gfp9qSmSlgBP7eaVzQe-WQ,"We saw this place in a couple of YouTube videos and wanted to try it.

Nice room that filled up within 30 minutes of opening, so reservations are a must....",5,2023-05-21 01:13:59,"{'id': 'wrMz3KwPYEHcDLH5SW4lUA', 'profile_url': 'https://www.yelp.com/user_details?userid=wrMz3KwPYEHcDLH5SW4lUA', 'image_url': 'https://s3-media3.fl.yelpcdn.com/photo/KbDy9V0RCO935iAK1i_xoA/o.jpg', 'name': 'John C.'}"
ZxtU74SJMRoB8ZQXWwNtRQ,AqZfJUBAEQymObhe2tQftQ,https://www.yelp.com/biz/le-souffl%C3%A9-paris-2?adjust_creative=Gfp9qSmSlgBP7eaVzQe-WQ&hrid=AqZfJUBAEQymObhe2tQftQ&utm_campaign=yelp_api_v3&utm_medium=api_v3_business_reviews&utm_source=Gfp9qSmSlgBP7eaVzQe-WQ,"Since 1961, this restaurant has been specializing in SAVORY and SWEET souffles in both classic and modern takes. After realizing the size of this...",5,2023-04-27 17:18:58,"{'id': 'J6uFlaaoslwuijoG_kST4Q', 'profile_url': 'https://www.yelp.com/user_details?userid=J6uFlaaoslwuijoG_kST4Q', 'image_url': 'https://s3-media2.fl.yelpcdn.com/photo/gIUSy9CPd-QhKVGRFvMDsA/o.jpg', 'name': 'Paul L.'}"
ZxtU74SJMRoB8ZQXWwNtRQ,3ffLyTjs3zcYD8J4d-ZhpA,https://www.yelp.com/biz/le-souffl%C3%A9-paris-2?adjust_creative=Gfp9qSmSlgBP7eaVzQe-WQ&hrid=3ffLyTjs3zcYD8J4d-ZhpA&utm_campaign=yelp_api_v3&utm_medium=api_v3_business_reviews&utm_source=Gfp9qSmSlgBP7eaVzQe-WQ,"Classic small french restaurant experience!  Need a reservation. 

Reasonably priced for the quality of the meal.  

Chocolate soufflé.",5,2023-04-19 13:51:16,"{'id': 'YN-jW6fgliZVrabMhNqqOg', 'profile_url': 'https://www.yelp.com/user_details?userid=YN-jW6fgliZVrabMhNqqOg', 'image_url': 'https://s3-media1.fl.yelpcdn.com/photo/2dDnqOUceWmO24SZBUIM1g/o.jpg', 'name': 'Joe C.'}"
luWgxwdQDUpURV21UlWslQ,puzlAe2gEtIjbG6ciihW0w,https://www.yelp.com/biz/jos%C3%A9phine-chez-dumonet-paris-5?adjust_creative=Gfp9qSmSlgBP7eaVzQe-WQ&hrid=puzlAe2gEtIjbG6ciihW0w&utm_campaign=yelp_api_v3&utm_medium=api_v3_business_reviews&utm_source=Gfp9qSmSlgBP7eaVzQe-WQ,"Fabulous dinner and the staff were amazing !! Everything was delicious- if you are looking for a ""local"" spot - this is it.",5,2023-05-16 05:46:52,"{'id': 'PtOqKFFEhH06QcNKx2MptA', 'profile_url': 'https://www.yelp.com/user_details?userid=PtOqKFFEhH06QcNKx2MptA', 'image_url': 'https://s3-media2.fl.yelpcdn.com/photo/iZCP3OyevsNJRGtDFDx1lQ/o.jpg', 'name': 'Bryan B.'}"
luWgxwdQDUpURV21UlWslQ,lrclGZgLgMZ-ddGrrfLJ-Q,https://www.yelp.com/biz/jos%C3%A9phine-chez-dumonet-paris-5?adjust_creative=Gfp9qSmSlgBP7eaVzQe-WQ&hrid=lrclGZgLgMZ-ddGrrfLJ-Q&utm_campaign=yelp_api_v3&utm_medium=api_v3_business_reviews&utm_source=Gfp9qSmSlgBP7eaVzQe-WQ,I was feeling nostalgic and wanted a classic French meal.   I choose Chez Dumonet.   The inside decor indicates that this place has seen some shit.   A bit...,3,2023-02-17 13:55:29,"{'id': 'k3ViVY6b3G9kmTq7HtuVhA', 'profile_url': 'https://www.yelp.com/user_details?userid=k3ViVY6b3G9kmTq7HtuVhA', 'image_url': 'https://s3-media3.fl.yelpcdn.com/photo/F8TR9AxyQTb2fku0b_icew/o.jpg', 'name': 'James R.'}"
luWgxwdQDUpURV21UlWslQ,q8acGVKsTJbpbpADlkXHHg,https://www.yelp.com/biz/jos%C3%A9phine-chez-dumonet-paris-5?adjust_creative=Gfp9qSmSlgBP7eaVzQe-WQ&hrid=q8acGVKsTJbpbpADlkXHHg&utm_campaign=yelp_api_v3&utm_medium=api_v3_business_reviews&utm_source=Gfp9qSmSlgBP7eaVzQe-WQ,"We arrived for our reservation to a nearly empty restaurant, and were promptly ushered to a partly walled-off seating area in the back, adjoining an odorous...",1,2022-11-30 13:26:44,"{'id': 'nMGKV-zOWbRpHzqCpkuFCA', 'profile_url': 'https://www.yelp.com/user_details?userid=nMGKV-zOWbRpHzqCpkuFCA', 'image_url': 'https://s3-media4.fl.yelpcdn.com/photo/F7UKfN6HLoVaEvJRAnnfGQ/o.jpg', 'name': 'Danni C.'}"
pQPK-eoMbVgcQE5ZlEreAg,xXiAbYBD6dtA3nmOV5cWhA,https://www.yelp.com/biz/le-roi-de-pique-paris-2?adjust_creative=Gfp9qSmSlgBP7eaVzQe-WQ&hrid=xXiAbYBD6dtA3nmOV5cWhA&utm_campaign=yelp_api_v3&utm_medium=api_v3_business_reviews&utm_source=Gfp9qSmSlgBP7eaVzQe-WQ,"Aloha, walking around the neighborhood we stumbled upon this great find. Good solid French bistro food at a very reasonable price. The veal with pasta was...",5,2023-05-22 05:43:46,"{'id': '5FyxwJFU0bhiNfdVXO1jlw', 'profile_url': 'https://www.yelp.com/user_details?userid=5FyxwJFU0bhiNfdVXO1jlw', 'image_url': 'https://s3-media2.fl.yelpcdn.com/photo/QYxgsY6aoAojVcibAhPoWA/o.jpg', 'name': 'Rob B.'}"
pQPK-eoMbVgcQE5ZlEreAg,9T3xZFuuICBRIGuFjR5jPg,https://www.yelp.com/biz/le-roi-de-pique-paris-2?adjust_creative=Gfp9qSmSlgBP7eaVzQe-WQ&hrid=9T3xZFuuICBRIGuFjR5jPg&utm_campaign=yelp_api_v3&utm_medium=api_v3_business_reviews&utm_source=Gfp9qSmSlgBP7eaVzQe-WQ,"This place is amazing! We went for lunch, had wine, quiche of the day and a croque m. Will def be back.",5,2023-04-10 09:21:42,"{'id': 'VbX_CcypG1zyE6OJ6pcgUA', 'profile_url': 'https://www.yelp.com/user_details?userid=VbX_CcypG1zyE6OJ6pcgUA', 'image_url': 'https://s3-media2.fl.yelpcdn.com/photo/Qtmm9330AE9CGj2jgNTQyg/o.jpg', 'name': 'Rebecca B.'}"
pQPK-eoMbVgcQE5ZlEreAg,M0jKU4BOljtdGz3lK4jVTw,https://www.yelp.com/biz/le-roi-de-pique-paris-2?adjust_creative=Gfp9qSmSlgBP7eaVzQe-WQ&hrid=M0jKU4BOljtdGz3lK4jVTw&utm_campaign=yelp_api_v3&utm_medium=api_v3_business_reviews&utm_source=Gfp9qSmSlgBP7eaVzQe-WQ,Good food and good service. Menu was in French and had no pictures so we try to make use of the little English words that were listed.  We ordered based on...,5,2023-04-03 09:58:09,"{'id': '-rv6qYdHt_kHYpHKzGPPJA', 'profile_url': 'https://www.yelp.com/user_details?userid=-rv6qYdHt_kHYpHKzGPPJA', 'image_url': None, 'name': 'Cal N.'}"
4OEhHYGyNN5DIxpdSTUy_A,ODd7vY-JGNYxg6LO5cv1_w,https://www.yelp.com/biz/restaurant-le-meurice-alain-ducasse-paris-2?adjust_creative=Gfp9qSmSlgBP7eaVzQe-WQ&hrid=ODd7vY-JGNYxg6LO5cv1_w&utm_campaign=yelp_api_v3&utm_medium=api_v3_business_reviews&utm_source=Gfp9qSmSlgBP7eaVzQe-WQ,"As I entered the magnificent realm of Le Meurice by Chef Alain Ducasse, I could feel the opulence enveloping my senses. The resplendent surroundings...",5,2023-05-20 02:45:39,"{'id': 'G-F-3FUp6BdkTaWQjn0T8g', 'profile_url': 'https://www.yelp.com/user_details?userid=G-F-3FUp6BdkTaWQjn0T8g', 'image_url': 'https://s3-media1.fl.yelpcdn.com/photo/F2IKnhd63_XldsGMHdSsLA/o.jpg', 'name': 'Genevieve D.'}"
4OEhHYGyNN5DIxpdSTUy_A,pDtxDk37xQLGutQF42PPmw,https://www.yelp.com/biz/restaurant-le-meurice-alain-ducasse-paris-2?adjust_creative=Gfp9qSmSlgBP7eaVzQe-WQ&hrid=pDtxDk37xQLGutQF42PPmw&utm_campaign=yelp_api_v3&utm_medium=api_v3_business_reviews&utm_source=Gfp9qSmSlgBP7eaVzQe-WQ,"We were in Paris for the week and asked the concierge at our hotel, the Shangri-La, to make a number of reservations for us at two- and three-starred...",2,2023-04-19 15:13:04,"{'id': '-dcYQQ9lG2gNI7pjaKqywQ', 'profile_url': 'https://www.yelp.com/user_details?userid=-dcYQQ9lG2gNI7pjaKqywQ', 'image_url': 'https://s3-media2.fl.yelpcdn.com/photo/qTJkc_axsxnZRqCV1hpAmA/o.jpg', 'name': 'Stephen K.'}"
4OEhHYGyNN5DIxpdSTUy_A,iJQXIWWGwwet14wcpGt0_g,https://www.yelp.com/biz/restaurant-le-meurice-alain-ducasse-paris-2?adjust_creative=Gfp9qSmSlgBP7eaVzQe-WQ&hrid=iJQXIWWGwwet14wcpGt0_g&utm_campaign=yelp_api_v3&utm_medium=api_v3_business_reviews&utm_source=Gfp9qSmSlgBP7eaVzQe-WQ,The most beautiful dining room in Paris and possibly one of the most gorgeous in the world! Le Meurice in Paris is a Michelin starred restaurant by the...,5,2022-12-01 21:01:00,"{'id': 'aHUiRPr4rhIEh-v1_HhORQ', 'profile_url': 'https://www.yelp.com/user_details?userid=aHUiRPr4rhIEh-v1_HhORQ', 'image_url': 'https://s3-media1.fl.yelpcdn.com/photo/5J36CIIqaDH7us3DxaX_Mg/o.jpg', 'name': 'Jonathan W.'}"
